,content
1882,besok sore kawan kawan panggung resistensi gema suara gugat jerat manusia bas nyawa wib parkir padu uin sunan kalijaga daulathijau daulatrakyat
1883,halo sahabat suka pus iranian corner uin sunan kalijaga yogyakarta bekerjasama konsulat budaya iran sembah iranian film screening judul where are my shoes laksana
1884,halo sahabat suka pus iranian corner uin sunan kalijaga yogyakarta bekerjasama konsulat budaya iran sembah iranian film screening judul where are my shoes laksana
1885,tuhan mahasiswa semester uin sunan kalijaga
1886,uin sunan kalijaga
1887,uin sunan kalijaga
1888,besok pagi siang jaga stand bazar buku sore malam silaturahmi rumah prof drs h yudian wahyudi a ph rektor uin sunan kalijaga yogyakarta chat me
1889,nge lanjutin cerita alam nge laundry ku nge laundy malang jalan sunan kalijaga uin nelongso express
1890,diesnatalis xiv faculity of social sciences and humanites tanggal oktober open gate wib gedung prof amin abdullah uin sunan kalijaga yogyakarta contact person laila
1891,segenap keluarga cssmora nasional selamat anggota cssmora uin sunan kalijaga yogyakarta angkat andy rosyidin muhammad rafi nuzul fitriansyah kontribusi presenter muktamar pikir santri nusantara cssmora pbsb
1892,buah hormat undang prof drs kh yudian wahyudi a ph beliau rektor uin sunan kalijaga president of asi islamic universities association aiua beliau seringkali sapa
1893,firman jaya daeli amp pakar ugm jd pembcr sminar nsional syariah amp hukum universitas islam negeri fsh uin sunan kalijaga yogya okt ribu mhs jd pserta tema seminar urgensitas hkum dlm menjga kdaulatan rakyat dgn spirit pancasila penyelenggra dema buka dekan fsh
1894,firman jaya daeli amp pakar ugm jd pembcr sminar nsional syariah amp hukum universitas islam negeri fsh uin sunan kalijaga yogya okt ribu mhs jd pserta tema seminar urgensitas hkum dlm menjga kdaulatan rakyat dgn spirit pancasila penyelenggra dema buka dekan fsh
1895,semangat gelora lomba tata upacara bendera paskibra tingkat nasional jumat halaman gedung prof kh saifuddin zuhri uin sunan kalijaga yogyakarta video taken by
1896,writing training fkist suwanto oktober fakultas sains teknologi uin sunan kalijaga
1897,ilmu industri terang solusi laboratorium padu uin sunan kalijaga yogyakarta
1898,diesnatalis xiv faculity of social sciences and humanites tanggal oktober open gate wib gedung prof amin abdullah uin sunan kalijaga yogyakarta contact person laila
1899,assalamualaikum wr wb salam hangat keluarga mahasiswa nahdlatul ulama uin sunan kalijaga kabar teman sikap marak lomba tulis kuat kader organ
1900,kenal hamdan saifullah lahir cirebon maret mahasiswa aktif fakultas syariah hukum uin sunan kalijaga yogyakarta prodi hukum keluarga islam tempuh didik kota
1901,mor ugm uin sunan kalijaga uny upn uii umy poltekkes aau isty akprind pertamina mor sik siner energi
1902,diesnatalis xiv faculity of social sciences and humanites tanggal oktober open gate wib gedung prof amin abdullah uin sunan kalijaga yogyakarta contact person laila
1903,tujuh istimewa nkri rektor uin sunan kalijaga bangkitmedia
1904,mahasiswa fakultas ekonomi bisnis islam uin sunan kalijaga yogyakarta febi uinsuka bawa berita gembira muhamad fuji hakiki akuntansi syariah kiki ayu handayani manajemen uang
1905,uin sunan kalijaga luas jejaring usaha swasta perihal laku bentuk program kunjung kerja pt paragon technology and innovation usaha familiar
1906,rangka wujud kampus unggul muka uin sunan kalijaga aktif bangun jejaring lembaga guru lembaga perintah lembaga swasta kerja
1907,ikat keluarga alumni uin sunan kalijaga ikasuka aceh selenggara seminar nasional tema afeksi masyarakat bangun aceh pasca otsus aula rektorat uin
1908,orang fakultas uin sunan kalijaga program visit government dema fishum instansi negara kunjung kpk ri
1909,imasasi indonesia selamat pilih dr tulus musthofa lc ma dosen pba uin sunan kalijaga jogjakarta ketua imla pilih periode moga emban amanah adil totalitas loyalitas imasasi indonesia
1910,imasasi indonesia selamat pilih dr tulus musthofa lc ma dosen pba uin sunan kalijaga jogjakarta ketua imla pilih periode moga emban amanah
1911,informasi bantu uin sunan kalijaga ulik identitas sang milik akun
1912,sih anak uin sunan kalijaga yogayakarta bener ga sih
1913,orang anak uin sunan kalijaga jurus didik agama islam isi otak hati setan orang biadab moga cepat mati kau kau hitung bulu bulu kucing neraka
1914,bener bro pakai teori rolandbarthes skripsi anak kpi uin sunan kalijaga bro next level banget pokokna
1915,diesnatalis xiv faculity of social sciences and humanites tanggal oktober open gate wib gedung prof amin abdullah uin sunan kalijaga yogyakarta contact person laila
1916,doi mahasiswa uin sunan kalijaga jogja jurus didik agama islam sek napas gak nyiksa amp laku jahanam gitu sis lin sek banget pas kucing sakaratul maut amp mati kucing
1917,uin sunan kalijaga nder udah klarifikasi
1918,riza news ciduk kampus kuliah uin sunan kalijaga jogja jurus pai semester nama ahmad azam ibadurrohman tau sosmed kampus nda
1919,news tau akun uin sunan kalijaga jogja nda
1920,news cyduk kampus kuliah uin sunan kalijaga jogja jurus pai semester nama ahmad azam ibadurrohman
1921,uin sunan kalijaga jurusa tarbiyah td gue liat lg pulka jatim skrg tp lapor ttp jalan
1922,hangyul tetep aja gan biar ga marah tonton film yg primajasa rumah ga putus asa usul nama indonesia uin sunan kalijaga yogyakarta bal kenal si
1923,rektor uin sunan kalijaga prof yudian wahyudi radikalisme indonesia level nyata tum pbnu kh said aqil siroj radikalisme uinyogya
1924,selamat malam air kosan nyala air kos belah air pdam nyala daerah sunan kalijaga uin
1925,rektor uin sunan kalijaga prof kh yudian wahyudi tanam bangsa cinta tanah air
1926,lomba paskibra uin sunan kalijaga yogyakarta rabu dokumentasi ist
1927,rektor uin sunan kalijaga yogyakarta yudian wahyudi masuk bursa menteri menag menristekdikti nasional yogya uin
1928,diesnatalis xiv faculity of social sciences and humanites tanggal oktober open gate wib gedung prof amin abdullah uin sunan kalijaga yogyakarta contact person laila
1929,ribu mahasiswa dosen cs karyawan uin sunan kalijaga yogyakarta ketemu anak innalilahi
1930,include air listrik kasur lemari pakai wifi iur kos air minum bayar sunan kalijaga ub dalem uin pintu samping ub deket watugong
1931,assalamualaikum id kalo atm unit uin sunan kalijaga takut ngantri tau tau udah semester enam trims njih aisyah samirono
1932,kunjung mahasiswa uin sunan kalijaga sahabatbahasa sahabatsastra sahabatdikbud
1933,buka album foto hujan ku juang rantau pulau jawa agustus silam rupa kelulus masuk program uin sunan kalijaga yogyakarta
1934,undang salah salah narasumber dr waryono beliau lahir cirebon oktober jabat wakil rektor bidang mahasiswa kerjasama uin sunan kalijaga juli
1935,pacar cewek putri wakil dekan uin sunan kalijaga lupa fakultas sifat olah olah lihat mata risih putus hubung
1936,uin sunan kalijaga islam azaz tuju
1937,meetup senin oktober selesai uin sunan kalijaga yogyakarta
1938,bahagia hmi ku hmi fakultas syar ah hukum uin sunan kalijaga yogyakarta mari ajar tarung opini tarung gagas
1939,ayoooo meet upp daerah uin sunan kalijaga
1940,help rt cari samsung galaxy warna hitam casing bening isi polaroid sticker tulis tan lalana warna merah wallpaper pkn stan rel jereta api uin sunan kalijaga yogyakarta tolong temu harap dm ya terimakasih
1941,ahlan wa sahlan assalamualaikum ekonomi robbani alhamdulillah siang ksei feb undip tamu forsebi uin sunan kalijaga yogyakarta smg jalin ukhuwah islamiyah amp smg ilmu yg dpt manfaat aamiin anjangsini ksei solid kseifebundip
1942,assalamu alaikum warahmatullahi wabarakatuh icommfest hmps kpi uin sunan kalijaga yoguakarta salam komunikasi generasi muda kpi hmps komunikasi siar islam uin sunan kalijaga yogyakarta
1943,repost from kpi uinsuka with app assalamu alaikum warahmatullahi wabarakatuh icommfest hmps kpi uin sunan kalijaga yoguakarta salam komunikasi generasi muda kpi hmps komunikasi
1944,ukt mahal mata loc uin sunan kalijaga yk
1945,tunggu hilang sadar arti uin sunan kalijaga yogyakarta
1946,jaksa negeri yogyakarta narasumber acara latih profesi jaksa selenggara pusat studi konsultasi hukum pskh fakultas syar ah hukum uin sunan kalijaga yogyakarta
1947,langsung audit mutu internal ami laku lembaga jamin mutu uin sunan kalijaga yogyakarta buka ami fishum langsung senin oktober ruang sidang lantai ii fishum
1948,mahasiswa bki kuasa tehnologi media bki ayook acara biar video konseling viral support cyber counseling workshop video kreatif dakwah fakultas dakwah komunikasi uin sunan kalijaga
1949,kamis aksi ubah jalan laksana revolusi uin sunan kalijaga info
1950,rekomendasi tulis bidang tafsir islami dot co syaikh jalil al krapyaki dosen ilmu tafsir uin sunan kalijaga yogyakarta
1951,uin sunan kalijaga tdk ajar sih ponpes arromah putri malang wkwkwkwkwkkwwkkwwk
1952,jogja masuk orang liberal rame uin sunan kalijaga larang cadar edar kampus disertasi nyeleneh ugm
1953,siang sore alhamdulillah selesai materi zakat in the industrial revolution uin sunan kalijaga yogyakarta acara international short course hadir mahasiswa
1954,terimakasih keluarga tim kelola al bidayah jurnal didik dasar islam amp dosen prodi pgmi fitk uin sunan kalijaga yogyakarta percaya event family gatheringnya tim tour
1955,muda milenial kali mahasiswa uin sunan kalijaga yogyakarta prodi pmi cerita mahasiswa proses ppm program kembang masyarakat salah desa kabupaten
1956,timbang kontroversi prof drs kh yudian wahyudi a ph sang guru fakultas syariah hukum uin sunan kalijaga yogyakarta
1957,univ nih hahahha lolos kah usu ui uin sunan kalijaga unila yg
1958,kenal ombudsman mahasiswa uin sunan kalijaga laku kunjung ombudsmanri awasitegurlaporkan
1959,paviliun khusus putri lokasi strategis kampus uny ugm atmajaya sanata dharma upn ukdw uin sunan kalijaga fasilitas kamar bed lemari meja ajar ac kamar mandi
1960,alhamdulillah ketemu senior ushuluddin uin sunan kalijaga jogja gus hilmyhasbullah senator dpd ri dapil prov diy ning nadlifah anggota dpr ri dapil jateng moga beliau jalan amanah
1961,tat tvam asi you are it filsafat timur uin sunan kalijaga bahas filosofi hindu bonus nonton cuplik lagu rab ne bana jodi macth made by god jodoh cipta tuhan filosofis ajar mistisme tasawuf
1962,hm ps didik fisika uin sunan kalijaga yogyakarta lomba esai nasional sma ma smk derajat seminar beasiswa escom buka get ready for escom fair save the date and don miss it
1963,terimakasih uin sunan kalijaga fak syariah amp hukum tour bal labiru tour hub tour advisor cs com
1964,selamat menang lomba vlog rangka syukur lahir uin sunan kalijaga september menang lomba vlog dies uin firman hidayat didik agama islam fitk piala
1965,politik dr andy dermawan dosen uin sunan kalijaga amp majelis tabligh pp muhammadiyah oh ya ppi awards acara loh hadir cp haekal
1966,keluarga iat sukses praktikum lsqh uin sunan kalijaga yogyakarta
1967,uin sunan kalijaga selenggara international short course
1968,assalamu alaykum maaf kak kenal muhamad dwi mahasiswa uin sunan kalijaga maksud aju mohon data skripsi kak teliti judul sisi manusia antartokoh novel prahara cinta karya abu umar basyier
1969,dokumentasi seminar era revolusi industri mahasiswa milenia mbak aisyah chairil mas al fath bagus panuntun el nur teatrikal b uin sunan kalijaga
1970,lokasi deket uin sunan kalijaga
1971,janji status cpns doktor uin sunan kalijaga duga laku tipu rp miliar jpnews
1972,doktor uin sunan kalijaga duga laku tipu cpns rp miliar korban mantan mahasiswa suara generasi suaragenerasi
1973,doktor uin sunan kalijaga duga laku tipu cpns rp miliar korban mantan mahasiswa
1974,besok senin uin sunan kalijaga yogyakarta habib jafar
1975,moderasi agama muqowwim dosen uin sunan kalijaga malang oktober
1976,cm anak uin sunan kalijaga ngga diglibnya emang lg gabisa akses ya
1977,kost putra lokasi balirejo timoho umbulharjo yogyakarta uin sunan kalijaga harga rp rp rp ac tv masuk listrik bayar min
1978,animal handling biology science biologi mice rats laboratorium padu uin sunan kalijaga yogyakarta
1979,kunjung dosen mahasiswa prodi pai pascasarjana iaim nu metro lampung prodi pai program magister fitk uin sunan kalijaga yogyakarta jalin kerjasama
1980,rt muhammadiyah fitrah ashary mahasiswa umm hasil kalah tim debat ugm tim debat uin sunan kalijaga semi final babak final hasil kalah tim debat stie perbanas surabaya ajang management
1981,fitrah ashary mahasiswa umm hasil kalah tim debat ugm tim debat uin sunan kalijaga semi final babak final hasil kalah tim debat stie perbanas surabaya ajang management education fair
1982,wr iii uin dukung malam puncak dies natalis fishum wakil rektor bidang mahasiswa uin sunan kalijaga yogyakarta dr waryono sambut acara malam puncak dies natalis fakultas
1983,alhamdulillah salah giat mahasiswa uin sunan kalijaga yogyakarta laksana agenda plp sma muhammadiyah yogyakarta ajar asyik mapel biologi anak anak kelas xi mipa
1984,okt kunjung mahasiswa uin sunan kalijaga jogja diskusi kait teliti terima koord pt bpk tri nugroho barca kp
1985,jarang jarang nih nyanyi hymne uin sunan kalijaga
1986,kammi leadership training dauroh marhalah kammi uin sunan kalijaga
1987,ahli saksi abdul aziz uin sunan kalijaga
1988,lomba tata upacara bendera siswa ma sma smk tingkat nasional mention pasu gas aksi rebut piala rektor uin sunan kalijaga total hadiah juta
1989,dermawan dosen uin sunan kalijaga amp majelis tabligh pp muhammadiyah hadir cp haekal khadijah kastrat ppiiium dakwah ukhuwah intelektual
1990,workshop video kreatif dakwah fakultas dakwah komunikasi uin sunan kalijaga yogyakarta selenggara workshop video kreatif dakwah oktober gedung prof kh saifuddin zuhri pau lantai
1991,helat aicis hotel mercure batavia jakarta oktober gelar pamer tajuk islamic higher learning expo ihle ihle uin sunan kalijaga tampil
1992,dies fishum uin sunan kalijaga sembah seminar bangsa rawat asa bangsa pusar wacana media massa isi bicara keren binggo achmad uzair ip a ph dosen
1993,kankemenag kota yogyakarta selasa terima enam mahasiswa uin sunan kalijaga yogyakarta laku praktek kerja lapang damping dosen bimbing ahmad muhammad kemenag kota
1994,team ekonomi tani langsung pertandiangan maba cup selenggara hmps sa uin sunan kalijaga yogyakarta ekonomi tani kirim delegasi team nya
1995,come and join us just for days again ikhlas bakti bina abdi islami publikasi humas media pramuka uin sunan kalijaga yogyakarta follow us on facebook racana suka nas fanspage gera pramuka uin sunan kalijaga yogyakarta
1996,stadium general mahasiswa ta fakultas ilmu sosial humaniora uin sunan kalijaga yogyakarta stadium general mahasiswa akademik langsung senin
1997,salam sejahtera kenal ananda a mahasiswi prodi mpi uin sunan kalijaga yogyakarta laku teliti paham agama mahasiswa mohon bantu isi questionnaire thank salam
1998,pt erporate solusi global uin sunan kalijaga diskusi peluang kerjasama bidang daya resources utama talent it giat program magang publikasi lowong kerja latih
1999,orang kreatif mandiri by denin alkangean celana lorot semangat lorot bait pesan prof dr musya asy arie mantan rektor uin sunan kalijaga yogyakarta
2000,komunitas public relations oriented pro pro community prodi ilmu komunikasi fakultas ilmu sosial humaniora uin sunan kalijaga yogyakarta dulang prestasi sabet juara acara
2001,saksi pilih duta febi uin sunan kalijaga mahasiswa mahasiswi ter terrrnyaaa febi rangkai seleksi tes bakat tes wawancara karantina nilai
2002,uin sunan kalijaga yogyakarta kirim mahasiswa delegasi students mobility program menteri agama ri singapura malaysia thailand tanggal november
2003,fakultas adab uin sunan kalijaga
2004,pimpin wakil prm fadib berkontestasi pemilwa fakultas adab ilmu budaya uin sunan kalijaga yogyakarta
2005,produksi talkshow volunter magang mahasiswa komunikasi siar islam uin sunan kalijaga studio talkshow mitra wacana kamis projek magang mahasiswa kpi uin
2006,gitu lokasi kerja uin sunan kalijaga kak bantumiminbkn
2007,live report langsung dinamit futsal championship gor uin sunan kalijaga ayo dukung tim viva tambang
2008,alhamdulillah terbit buku bunga rampai judul islam gores pena budaya buku tulis dosen fakultas adab ilmu budaya uin sunan kalijaga yogyakarta
2009,amp bekerjasama dg program kaderisasi ulama pku gontor sembah workshop pikir amp adab islam senin desember teatrikal pustaka lt pustaka uin sunan kalijaga kuuy ramaikeeun
2010,jalan moga gusti allah meridhoi fakultas dakwah uin sunan kalijaga
2011,assalamualaikum wr wb hai teman keluarga mahasiswa banjarnegara universitas islam negeri sunan kalijaga yogyakarta kembara uin suka acara
2012,jeneng kasih info kost bebas kampus uin jalan sunan kalijaga kalang penuh kamar kosong pas
2013,daerah sunan kalijaga mas uin
2014,acara bedah buku juang kemarin uin sunan kalijaga bedahbuku uinsuka jogja perjuanganbelumberakhir uin sunan kalijaga yogyakarta
2015,alhamdulillah laksana kelas literasi digital perdana pustaka unu yogyakarta materi mahasiswa ilmu pustaka uin sunan kalijaga terimakasih mas sharing ilmu
2016,tim delegasi trunojoyo mahasiswa semester semester gabung pusat studi konsultasi hukum percaya fakultas syar ah hukum uin sunan kalijaga wakil ajang
2017,teater eska uin sunan kalijaga yogyakarta judul pancer ing penjuru sutradara rahmad hidayat mentas sukses
2018,sharing td alhamdulillah senin november terima kunjung dri mahasiswa fakultas dakwah jurus komunikasi siar islam uin sunan kalijaga jogjakarta uinsuka sharing sejarah amp konsep dakwah teras dakwah cek yg kenal tag orang
2019,bgp ot uin as id universitas islam negeri sunan kalijaga yogyakarta id outage affected prefixes
2020,kabar didik indonesia buah nyata singkat mahasiswa korp sakti pmii rayon wisma tradisi uin sunan kalijaga yogyakarta menteri ri nadiem makarim emban tugas pesanuntuknadhiem pmiirayonwistrad ri
2021,komunitas public relations oriented pro prodi ilmu komunikasi fakultas ilmu sosial humaniora uin sunan kalijaga sabet juara acara festival ajisaka ugm cabang lomba tempur
2022,moderator acara keren dialog moderasi agama selenggara kerjasama pustaka uin sunan kalijaga konsulat budaya dubes iran hadir bicara alimatul qibtiyah
2023,keluarga cssmora uin sunan kalijaga selamat sukses saudara sdr alif jabar kurdi raih juara lomba esai nasional tema moderasi islam adab manusia era iain purwokerto
2024,keluarga cssmora uin sunan kalijaga selamat guru nasional november jasa bakti kenang salam loyalitas batas cssmorauinsuka cssmoranasional cssmorahits
2025,kunjung wawancara teliti mahasiswa uin sunan kalijaga yogyakarta mata kuliah banding zakat wakaf penuh tugas uji semester teliti struktur organisasi lembaga proses kelola dana zis wakaf lembaga
2026,kunjung wawancara teliti mahasiswa uin sunan kalijaga yogyakarta mata kuliah banding zakat wakaf penuh tugas uji semester teliti struktur
2027,deklarasi rupa langkah kenal korp sakti pmii rayon wisma tradisi civitas akademika uin sunan kalijaga bawa isu pesan tri didik budaya pesanuntuknadhiem pmiirayonwistrad ri
2028,ri assalamu alaikum admin nanya formasi dosen didik ipa uin sunan kalijaga syarat didik ipa lulus didik sains konsentrasi didik kimia lamar lowong terima kasih mohonpencerahannya
2029,ri assalamu alaikum admin nanya formasi dosen didik ipa uin sunan kalijaga syarat didik ipa lulus didik sains konsentrasi didik kimia lamar lowong terima kasih
2030,pagi november pustaka uin sunan kalijaga terima buah buku judul sekutu israel iran amerika serikat serah mas imam sopyan pustaka igra depok
2031,rutin mari hadir majlis dzikir maulidurrasul muhammad saw rangka rutin senin jamaah al khidmah uin sunan kalijaga yogyakarta senin desember ba da sholat
2032,calon presiden wakil presiden mahasiswa uin sunan kalijaga delegasi partai rebah target program kerja tingkat cepat wifi kampus sedia ruang leseh lengkap terminal
2033,segenap keluarga cssmora nasional selamat anggota cssmora uin sunan kalijaga yogyakarta mayola andhika ang hubab naufal ang karina rahmi f ang prestasi bicara call for paper iconhumans uin walisongo
2034,buah contoh sederhana yogyakarta uin sunan kalijaga heboh wacana larang cadar lingkung kampus
2035,jokowi guru dar profesi guru buah selamat guru nasional ikhlas bakti bina abdi islami publikasi humas media pramuka uin sunan kalijaga yogyakarta follow us
2036,seblak kampus uin sunan kalijaga yogyakarta
2037,alif jabal kurdi mahasiswa jurus ilmu al qur an tafsir fakultas ushuluddin pikir islam semester vii uin sunan kalijaga yogyakarta hasil raih juara sisih final ajang
2038,teater eska laksa pentas produksi xxxiv kota yogyakarta surabaya yogyakarta gelar tanggal november gelanggang mahasiswa uin sunan kalijaga
2039,mc anniversary kopma uin sunan kalijaga yogayakarta
2040,mentas menang indonesia karya putu wijaya teater saba mahasiswa fak dakwah komunikasi uin sunan kalijaga
2041,minggu tertib muncul jukir indomaret sunan kalijaga uin atm tp error duit parkir
2042,min nama guru kuk gak temu uin sunan kalijaga yogyakarta
2043,min isi guru kuk kampus muncul nama pt uin sunan kalijaga yogyakarta
2044,iya uin sunan kalijaga
2045,kunjung wawancara teliti mahasiswi uin sunan kalijaga yogyakarta mata kuliah pajak amp zakat penuh uji semester jum at november teliti
2046,assalamualaikum wr wb hai teman keluarga mahasiswa banjarnegara universitas islam negeri sunan kalijaga yogyakarta kembara uin suka acara rutin lhoo bakti
2047,forum sahabat inklusi uin sunan kalijaga yogyakarta sembah jalan sehat sinergi wujud lingkung inklusi tau detail acara obrol vara chandra forsi uin sunan kalijaga besok pagi radio taman wisata candi
2048,alhamdulillah acara tari plp mahasiswa uin sunan kalijaga ajar aula kampus sma muhammadiyah yogyakarta jum at mahasiswa laku praktik sekolah tanggal
2049,late post borong juara lomba mqk pekan raya iat uin sunan kalijaga berita lengkap lihat
2050,laporbkn nama pt prodi muncul autocomplete kombinasi inputan nama pt maksud uin sunan kalijaga yogyakarta mohon respon cepat sempit mepet terima kasih
2051,kelas uin sunan kalijaga yogyakarta muncul kolom autocomplete pas entry something wrong
2052,ojo pamrih men ndak kabur nilai orang bedah buku islam budaya uin sunan kalijaga
2053,assalamu alaikum sahabat syariah mohon doa restu team mcc fakultas kompetisi lomba sidang semu nasional uin sunan kalijaga yogyakarta syariahkeren lombadebat mentaljuara
2054,min eror ya kmren sore sbnrnya selese proses online nya tpi kendala input nama kampus yg muncul gmna solusi kampus uin sunan kalijaga database sistem gmn min
2055,febi iain palangka raya laku jaja kerjasama febi uin sunan kalijaga yogyakarta
2056,keluarga ukm pramuka uin sunan kalijaga selamat sukses kak pilih delegasi uin sunan kalijaga yogyakarta giat student mobility progam negara malaysia singapura thailand laksana
2057,alhamdulillah guru wanita uin sunan kalijaga kamis prof dr maizer said nahdi dosen fakultas sains teknologi kukuh ketua senat prof dr siswanto
2058,seminar syariah preneur uin sunan kalijaga yogyakarta bentuk fokus bidang ilmu sesuai bidang tempuh akademisi uinsunankalijaga stebialmuhsin kpmpy mahasiswa
2059,assalamu alaikum min kualifikasi dosen didik sains uin sunan kalijaga yogyakarta isi didik sains rincian formasi tulis kualifikasi didik ilmu alam sains
2060,harmony in the moonlight acara ujung november fakultas adab uin sunan kalijaga yogyakarta ayo ketemu
2061,diy ri min kualifikasi dosen didik sains uin sunan kalijaga yogyakarta isi didik sains rincian formasi tulis kualifikasi didik ilmu alam sains ri diy
2062,rt diy lintas simpang uin sunan kalijaga pantau ramai lancar elshintaedisipagi
2063,bekal selamat gabung keluarga pustaka uin sunan kalijaga yogyakarta uinsukalib perpusuinsuka
2064,hadrah syifaul qulub berhasih juara pekan raya iat uin sunan kalijaga uin suka
2065,ma ri kak min nanya lulus uin sunan kalijaga yogyakarta thn prodi uang islam jurus uang islam konversi nama manajemen uang syariah daftar ma formasi verifikator uang program studi uang islam
2066,prodi uang syariah uin sunan kalijaga yk nama prodi keuangab islam ubah uang syariah ubah manajemen uang syariah pilih manajemen uang syariah tp ijazah uang syariah
2067,salah dosen teknik industri ubp karawang annisa indah pratiwi t t for best paper ciehis top st conference on industrial engineering and halal industries ciehis convention hall uin sunan kalijaga info lengkap
2068,giat donor darah selasa november uddpmikabsleman donordarah wib selesai uin sunan kalijaga poliklinik jalan timoho komplek uin sunan kalijaga caturtunggal depok sleman
2069,donordarah wib selesai uin sunan kalijaga poliklinik jalan timoho komplek uin sunan kalijaga caturtunggal depok sleman uddpmikabsleman pmisiapbantu
2070,futsal cjyc season tim upn tim uin sunan kalijaga pasuk lapang tanding id ligamahasiswa awalmasadepan limafutsal
2071,futsal cjyc season tim uin sunan kalijaga laku panas laga id ligamahasiswa awalmasadepan limafutsal
2072,tanding futsal cjyc season tim putra upn veteran lawan uin sunan kalijaga id ligamahasiswa awalmasadepan limafutsal
2073,hidayah hariani mahasiswa ilmu al quran tafsir fakultas ushuluddin pikir islam uin sunan kalijaga yogyakarta toreh tinta emas hasil sabet juara lomba essai tingkat nasional
2074,senat mahasiswa fakultas ushuluddin pikir islam uin sunan kalijaga percaya tuan rumah rakoornas rapat koordinasi nasional perdana senat mahasiswa ushuluddin ptkin indonesia
2075,academic writing fakultas ilmu sosial humaniora fishum uin sunan kalijaga yogyakarta bidang mahasiswa giat workshop akademik writing giat mahasiswa
2076,kuat identitas kampus inklusif fishum pld gelar fgd dosen jogja fakultas ilmu sosial humaniora bekerjasama pusat layan difabel pld uin sunan kalijaga selenggara
2077,bismillah sfnmcc uin sunan kalijaga esai universitas negeri semarang sukses
