,content
586,basis didik utama tempuh mbah cholil pesantren beliau sekolah formal sr konon kuliah uin sunan kalijaga lulus haul khcholilbisri
587,basis didik utama tempuh mbah cholil pesantren beliau sekolah formal sr konon kuliah uin sunan kalijaga lulus haul khcholilbisri
588,basis didik utama tempuh mbah cholil pesantren beliau sekolah formal sr konon kuliah uin sunan kalijaga lulus haul khcholilbisri
589,basis didik utama tempuh mbah cholil pesantren beliau sekolah formal sr konon kuliah uin sunan kalijaga lulus haul khcholilbisri
590,basis didik utama tempuh mbah cholil pesantren beliau sekolah formal sr konon kuliah uin sunan kalijaga lulus haul khcholilbisri
591,basis didik utama tempuh mbah cholil pesantren beliau sekolah formal sr konon kuliah uin sunan kalijaga lulus haul khcholilbisri
592,basis didik utama tempuh mbah cholil pesantren beliau sekolah formal sr konon kuliah uin sunan kalijaga lulus haul khcholilbisri
593,basis didik utama tempuh mbah cholil pesantren beliau sekolah formal sr konon kuliah uin sunan kalijaga lulus haul khcholilbisri
594,basis didik utama tempuh mbah cholil pesantren beliau sekolah formal sr konon kuliah uin sunan kalijaga lulus haul khcholilbisri
595,basis didik utama tempuh mbah cholil pesantren beliau sekolah formal sr konon kuliah uin sunan kalijaga lulus haul khcholilbisri
596,basis didik utama tempuh mbah cholil pesantren beliau sekolah formal sr konon kuliah uin sunan kalijaga lulus haul khcholilbisri
597,basis didik utama tempuh mbah cholil pesantren beliau sekolah formal sr konon kuliah uin sunan kalijaga lulus haul khcholilbisri
598,basis didik utama tempuh mbah cholil pesantren beliau sekolah formal sr konon kuliah uin sunan kalijaga lulus haul khcholilbisri
599,basis didik utama tempuh mbah cholil pesantren beliau sekolah formal sr konon kuliah uin sunan kalijaga lulus haul khcholilbisri
600,basis didik utama tempuh mbah cholil pesantren beliau sekolah formal sr konon kuliah uin sunan kalijaga lulus haul khcholilbisri
601,basis didik utama tempuh mbah cholil pesantren beliau sekolah formal sr konon kuliah uin sunan kalijaga lulus haul khcholilbisri
602,basis didik utama tempuh mbah cholil pesantren beliau sekolah formal sr konon kuliah uin sunan kalijaga lulus haul khcholilbisri
603,basis didik utama tempuh mbah cholil pesantren beliau sekolah formal sr konon kuliah uin sunan kalijaga lulus haul khcholilbisri
604,basis didik utama tempuh mbah cholil pesantren beliau sekolah formal sr konon kuliah uin sunan kalijaga lulus haul khcholilbisri
605,basis didik utama tempuh mbah cholil pesantren beliau sekolah formal sr konon kuliah uin sunan kalijaga lulus haul khcholilbisri
606,basis didik utama tempuh mbah cholil pesantren beliau sekolah formal sr konon kuliah uin sunan kalijaga lulus haul khcholilbisri
607,basis didik utama tempuh mbah cholil pesantren beliau sekolah formal sr konon kuliah uin sunan kalijaga lulus haul khcholilbisri
608,basis didik utama tempuh mbah cholil pesantren beliau sekolah formal sr konon kuliah uin sunan kalijaga lulus haul khcholilbisri
609,basis didik utama tempuh mbah cholil pesantren beliau sekolah formal sr konon kuliah uin sunan kalijaga lulus haul khcholilbisri
610,basis didik utama tempuh mbah cholil pesantren beliau sekolah formal sr konon kuliah uin sunan kalijaga lulus haul khcholilbisri
611,basis didik utama tempuh mbah cholil pesantren beliau sekolah formal sr konon kuliah uin sunan kalijaga lulus haul khcholilbisri
612,basis didik utama tempuh mbah cholil pesantren beliau sekolah formal sr konon kuliah uin sunan kalijaga lulus haul khcholilbisri
613,basis didik utama tempuh mbah cholil pesantren beliau sekolah formal sr konon kuliah uin sunan kalijaga lulus haul khcholilbisri
614,basis didik utama tempuh mbah cholil pesantren beliau sekolah formal sr konon kuliah uin sunan kalijaga lulus haul khcholilbisri
615,basis didik utama tempuh mbah cholil pesantren beliau sekolah formal sr konon kuliah uin sunan kalijaga lulus haul khcholilbisri
616,basis didik utama tempuh mbah cholil pesantren beliau sekolah formal sr konon kuliah uin sunan kalijaga lulus haul khcholilbisri
617,basis didik utama tempuh mbah cholil pesantren beliau sekolah formal sr konon kuliah uin sunan kalijaga lulus haul khcholilbisri
618,basis didik utama tempuh mbah cholil pesantren beliau sekolah formal sr konon kuliah uin sunan kalijaga lulus haul khcholilbisri
619,basis didik utama tempuh mbah cholil pesantren beliau sekolah formal sr konon kuliah uin sunan kalijaga lulus haul khcholilbisri
620,basis didik utama tempuh mbah cholil pesantren beliau sekolah formal sr konon kuliah uin sunan kalijaga lulus haul khcholilbisri
621,basis didik utama tempuh mbah cholil pesantren beliau sekolah formal sr konon kuliah uin sunan kalijaga lulus haul khcholilbisri
622,basis didik utama tempuh mbah cholil pesantren beliau sekolah formal sr konon kuliah uin sunan kalijaga lulus haul khcholilbisri
623,basis didik utama tempuh mbah cholil pesantren beliau sekolah formal sr konon kuliah uin sunan kalijaga lulus haul khcholilbisri
624,basis didik utama tempuh mbah cholil pesantren beliau sekolah formal sr konon kuliah uin sunan kalijaga lulus haul khcholilbisri
625,basis didik utama tempuh mbah cholil pesantren beliau sekolah formal sr konon kuliah uin sunan kalijaga lulus haul khcholilbisri
626,basis didik utama tempuh mbah cholil pesantren beliau sekolah formal sr konon kuliah uin sunan kalijaga lulus haul khcholilbisri
627,kait dg riwayat didik beliau pd dasa basis didik beliau tempuh pesantren beliau sekolah formal sr konon kuliah uin sunan kalijaga lulus haul khcholilbisri
628,basis didik utama tempuh mbah cholil pesantren beliau sekolah formal sr konon kuliah uin sunan kalijaga lulus haul khcholilbisri
629,rt majalahsm jimbrons muhammadiyahgl muhammadiyah kisah versi sepuh zaman muchlas abror syukrianto ar dll kisah uin sunan kalijaga ar kuliah ketemu pof mukti ali rektor uin
630,kisah versi sepuh zaman muchlas abror syukrianto ar dll kisah uin sunan kalijaga ar kuliah ketemu pof mukti ali rektor uin menteri agama mukti ngajar
631,selamat milad organisasi ku moga moga capai harap moga imm bertranformasi maju raih beril kaya negeri ikatanmahasiswamuhammadiyah pk imm adab uin sunan kalijaga
632,divisi kembang aparatur organisasi pao co yusuf hidayat uin sunan kalijaga yogyakarta
633,yogyakarta rangka kenal produk produk desa daya bina rumah zakat fasilitator gabung koordinasi wilayah yogyakarta welfare festival iks ilmu sejahtera sosial uin sunan kalijaga yogyakarta
634,tari kupu manis tari lihat adilla isi acara talkshow uin sunan kalijaga yogyakarta rencangskaba skaba tari autismawareness special
635,bazar buku murah lokasi halaman poliklinik uin sunan kalijaga yogyakarta tanggal maret
636,bazaar buku uin sunan kalijaga mampir liat terbit cari buku lawas idam eh ketemu eren play mikir ka ran release novel hehe kangen tulis bau jepangnya ka ran fans
637,assalamu alaikum sahabat dna uin sunan kalijaga jajak kerja flinders university australia bidang teliti islam dinassalam dna pendidikanislam direktorisekolahislam uinsunankalijaga flindersuniversityaustralia
638,tulis sy ttg prof zaini dahlan mantan rektor uin sunan kalijaga rektor uii dpt unduh gih gratis jg tulis pimpin pasca uin trmasuk prof amin abdullah prof machasin dll
639,catat bedah buku prof dirs saring sharing ch senin maret laboratorium studi al quran hadits uin sunan kalijaga yogyakarta jaga waras akal
640,bedah buku yai prof dirs pascasarjana uin sunan kalijaga yk
641,uin sunan kalijaga kolese de britto
642,acara bedah buku dirs saring sharing siang uin sunan kalijaga alhamdulillah lancar
643,paham cari jurnal curhat mamake wahyani lantai pustaka uin sunan kalijaga
644,terimakasih gus dirs luang isi diskusi buku saring sharing kampus cinta uin sunan kalijaga yogyakarta saringsebelumsharing
645,talkshow inspiratif mahasiswa prestasi uin sunan kalijaga registrasi talkshownya dapetin saldo gopay save the date gaisss kamis tanggal maret
646,minggu laksana peci regional m cssmora nasional bakti sosial cssmora uin sunan kalijaga yogyakarta selenggara rangkai sersantara cssmora uin sunan kalijaga yogyakarta cssmora cssmoranasional peci baksos
647,dewan eksekutif mahasiswa dema fakultas ilmu sosial humaniora fishum uin sunan kalijaga selenggara seminar kewirausahaan kreatif jumat gedung fishum seminar kali
648,cha uin sunan kalijaga
649,registrasi bedah buku gus nadir uin sunan kalijaga maret na nggeh gus panjenengan sampun nulis taseh mawon disuwun isine disuuwun bedah dirs
650,sabtu laksana galang dana korban bencana banten lampung selenggara departemen m cssmora uin sunan kalijaga yogyakarta cssmora cssmoranasional galangdana prayforbantendanlampung cssmorauinsuka pbsb
651,malam gaesss simak wede perempuan yaah selamat perempuan internasional fakultas ilmu sosial humaniora uin sunan kalijaga yogyakarta fishum muda
652,terima kasih respek kpd maba pascasarjana yg partisipasi antusias dlm giat user education moga nutrisi jalan studi uin sunan kalijaga
653,hallo millepreneurs ulin nuha pangesti fakultas ekonomi bisnis islam uin sunan kalijaga yogyakarta volunteer
654,pagi jumat ditlantas polda diy kunjung uin sunan kalijaga kunjung rangka sosialisasi program millennial road safety festival gelar
655,utbk mna kmuu dkt gk daerah dgn uin sunan kalijaga
656,lupa pantau akun official gaes happy holiday fakultas ilmu sosial humaniora uin sunan kalijaga yogyakarta fishum muda fishum
657,bakso aci jl sunan kalijaga pintu gerbang uin
658,urus gera mahasiswa islam indonesia komisariat pondok sahabat uin sunan kalijaga yogyakarta periode
659,selamat lantik kader kader pmii humaniora park urus komisariat pondok sahabat uin sunan kalijaga yogyakarta moga amanah jalan tugas urus
660,teman sejarah agama agama banding agama ushuluddin iain now uin sunan kalijaga yogya cebong ato kampret yg dpt kaos selfie amp upload medsos jgn lupa kasih taggar pa uye iainsukijo uinsukijo lebaran reuni kantin sukijo
661,fishum uin sunan kalijaga terima harga mitra lpka kemenkumham fishum muda fishum muka follow us ig twitter fb ilmu
662,postingan kammi uin sunan kalijaga
663,dosen tafsir al qur an uin sunan kalijaga yogyakarta sahiron syamsuddin saran orang ijtima ulama
664,tanggap lumayan kemarin tanggap univ islam majapahit mojokerto besok pagi tanggap iain surakarta lusa mei tanggap uin sunan kalijaga yogya dll
665,seminar series madu ilmu sosial studi agama fakultas ilmu sosial humaniora uin sunan kalijaga yogyakarta fishum muda fishum muka follow
666,workshop manajemen ojs prodi sosiologi program studi sosiologi fakultas ilmu sosial humaniora fishum uin sunan kalijaga yogyakarta giat workshop manajemen
667,rencana kolaborasi riset bkkbn fishum uin fakultas ilmu sosial humaniora uin sunan kalijaga yogyakarta fishum muda fishum muka follow us ig
668,rencana kolaborasi riset bkkbn fishum uin fakultas ilmu sosial humaniora uin sunan kalijaga yogyakarta fishum muda fishum muka follow us ig
669,sambut ultah sukatv fakultas dakwah komunikasi uin sunan kalijaga
670,selamat ulang sukatv fdk uin sunan kalijaga karya utk budaya nusantara baskara
671,halo sobat unala remaja usia yuk rapat uin sunan kalijaga besok senin april unala open booth gedung teatrikal fakultas dakwah komunikasi rangka diskusi publik lpm rhetor
672,papar program kerja ksei forsebi uin sunan kalijaga
673,berangkat tuju uin sunan kalijaga jogjakarta
674,assalamu alaikum wr wb sabtu april ksei fosei feb ums laku kunjung ksei forsebi uin sunan kalijaga jalin ukhuwah sharing ilmu forsebi jogja nasional ekonomirabbani
675,event tv konser damai hut sukatv uin sunan kalijaga sabtu april selesai poliklinik uin sunan kalijaga yogyakarta htm free sukatv karyauntuknegeri thanniversarysukatv baskara budayasatukannusantara
676,rapat lur teatrikal fakultas adab ilmu budaya uin sunan kalijaga sarasehan anak bangsa yg selenggara tmen kmsy keluarga mahasiswa sampang yogyakarta kuy rapat sedulurselawase ikpmjatim
677,ilmu ulama tipu daya setan jakarta realitas ustad achmad maimun salah orang lulus uin sunan kalijaga yogyakarta catat salah orang dosen iain salatiga cerita maqam akal imam al ghazali kamis
678,ilmu ulama tipu daya setan jakarta realitas ustad achmad maimun salah orang lulus uin sunan kalijaga yogyakarta catat salah orang dosen iain salatiga cerita maqam akal imam al ghazali kamis
679,book discussion jawa islam presenting vena meyer phd cand columbia university us and irfan afifi book author uin sunan kalijaga yogyakarta
680,perform tari nusantara bsor aisyah pancanaka acara talkshow how to build and sustain the partnership uinyk interactive center fishum uin sunan kalijaga tariannusantara pmiiuinjogja pmiifishum pmii pmiijogja pbpmii
681,saksi pentas kolaborasi gerbang budaya dap fakultas adab ilmu budaya uin sunan kalijaga uinsuka gerbangbudayauinsuka pentaskolaborasi
682,ika ilmu hukum uin sunan kalijaga yogyakarta diskusi selesai
683,selamat kpd muzdhalifah pisca aryani khairunnisa nurrahmah mariah safaanah mahasiswi public relation angkat hasil raih juara lomba tulis paper kena manajemen resiko pr acara party of public relation uin sunan kalijaga yogyakarta
684,jancukers yogya yuk mei malam uin sunan kalijaga ngocol guyon nyanyi jancuk an dll sarung serattripama satrajendra
685,talk show sdgs class how to build and sustain the partnership jumat april wib interactive center fakultas ilmu sosial humaniora uin sunan kalijaga yogyakarta cp aulia daftar talkshowsdgscla
686,soooo catat tanggal sabtu april selesai poliklinik uin sunan kalijaga yogyakarta htm free tunggu let join and paint the town red sukatv karyauntuknegeri thanniversarysukatv baskara
687,upaya edukasi mahasiswa pkl uin sunan kalijaga yogyakarta fakultas syariah hukum kankemenag kota yogyakarta seksi selenggara syariah
688,terima kasih adik adik program studi manajemen dakwah uin sunan kalijaga yogyakarta kunjung praktikum mandiri bpkh sukses moga
689,lembaga pers mahasiswa lpm rhetor uin sunan kalijaga yogyakarta gelar diskusi publik tema intoleransi rajalela media negara madgeshout
690,coba masjid al umm daerah merjosari mbak temu ust arifuddin masjid qolbun salim jl sunan kalijaga uin salah beliau isi kaji insya alloh beliau ruqyah syar iyah yg sesuai tuntun rasulullah
691,buku jendela dunia terang sepi minim ilmu selamat buku dunia baca buku ikhlas bakti bina abdi islami publikasi humas media pramuka uin sunan kalijaga yogyakarta follow us
692,uin sunan kalijaga yogyakarta ugm senior berani juang demokrasi hak rakyat nyali mahasiswalagibobosyantik mahasiswalagibobosyantik
693,rektor uin sunan kalijaga hadir sambut buka sertifikasi bimbing manasik haji minggu gedung asrama haji yogyakarta acara selenggara
694,terima kasih kepala biro administrasi akademik mahasiswa kerjasama uin sunan kalijaga drs maskul haji pd jasa abdi sukses sehat
695,kpi pusat kolaborasi uin sunan kalijaga selenggara workshop riset indeks kualitas program siar televisi hotel harper mangkubumi yogyakarta
696,rektor uin sunan kalijaga yogyakarta uin prof yudian wahyudi pesan harap sih pesan rektor uin yogyakarta acara yuk simak video salam siaransehatuntukrakyat
697,selamat malam sahabatpenyiaran workshop riset indeks kualitas program siar yogyakarta selesai laksana giat bekerjasama uin sunan kalijaga yogyakarta
698,mahasiswa saintek smt uin sunan kalijaga
699,anniversary sunan kalijaga televisi sembah konser damai angkat tema baskara budaya nusantara sabtu april selesai poliklinik uin sunan kalijaga yogyakarta htm free
700,assalamualaikum wr wb kenal nama jam chairani hasibuan program studi perban syariah fakultas ekonomi bisnis islam uin sunan kalijaga yogyakarta laku trial coba teliti selesai studi
701,live report langsung tanding bara hitam vs pangea petroleum cup gor uin sunan kalijaga ayo dukung tim viva tambang
702,uin uin sunan kalijaga jogja
703,padu suara gita savana jaya engkau selamat ulang psm gita savana uin sunan kalijaga yogyakarta moga jaya dunia padu suara jayalahselamalamanya
704,tau komentar mahasiswa uin sunan kalijaga difabel masyarakat didik ramah uin sunan kalijaga difabel yuk lihat hasil wawancara
705,donor darah keluarga mahasiswa nahdlatul ulama proudly present kmnu uin sunan kalijaga bekerjasama udd pmi kota yogyakarta hadir undang
706,harap tenang fakultas minggu evaluasi visi misi guys fyi fakultas ilmu sosial humaniora uin sunan kalijaga yogyakarta fishum muda
707,kenal ar fakultas ilmu sosial humaniora uin sunan kalijaga yogyakarta fishum muda fishum muka follow us ig twitter
708,uin sunan kalijaga seru milu integritas
709,uin sunan kalijaga seru milu integritas
710,kemarin uji promosi doktor gus asvin abdurrahman uin sunan kalijaga yogyakarta
711,pimpin indonesia ajar lagu gundul pacul tari gundul gundul pacul tradisional pgra uin sunan kalijaga yogayakarta
712,postingan kammi uin sunan kalijaga
713,uin sunan kalijaga dorong milu integritas
714,dokumentasi ceria family gathering febi uin sunan kalijaga yogyakarta pacitan jumpa acara gathering sukses uin sunan kalijaga contact person whatsapp phone ig co id fb
715,pusat studi pancasila bela negara uin sunan kalijaga seru moral pilih hak konstitusi suara rakyat arah bangsa seru
716,rektor uin sunan kalijaga ajak warga percaya kpu bawaslu kerja
717,siar pers pusat studi pancasila bela negara psp bn uin sunan kalijaga masyarakat percaya penuh kpu bawaslu selenggara milu
718,catat pilih serentak april lupa hak pilih ya kak golput solusi ayo pilih ikhlas bakti bina abdi islami publikasi humas media pramuka uin sunan kalijaga yogyakarta follow us on
719,akademisi yogyakarta ugm uin sunan kalijaga deklarasi milu damai selainitu seru warga hak pilih
720,pusat studi pancasila bela negara uin sunan kalijaga milu kualitas integritas
721,kisp diskus parkiba uin sunan kalijaga dgn tema sikap mahasiswa kait milu dgnn tuju utk tingkat sadar politik mahasiswa bangun dlm partisipasi pilih dasar yg sbg timbang pilih
722,mahasiswa program studi sastra inggris fakultas adab ilmu budaya uin sunan kalijaga yogyakarta toreh prestasi kancah nasional fachri hamzah pangestu hasil raih
723,late post galery rutin majlis iklil fakultas ekonomi bisnis uin sunan kalijaga yogyakarta jumat april wib febi uin
724,giat bekerjasama universitas islam negeri sunan kalijaga yogyakarta april hadir pd giat rektor uin yogyakarta prof drs yudian wahyudi ma ph dekan fakultas ilmu sosial humaniora dr mohammad sodik sos si
725,iya kemarin nntn uin sunan kalijaga skrg bru bomming
726,hasil semifinal stta cup fc uny hasil kalah uin sunan kalijaga skor menang fc uny
727,kemdikbud mohon info perihal aju ppg ktk isi aju muncul tab utk ngisi prodi lulus ref dirjen gtk mohon info utk jurus tafsir hadis uin sunan kalijaga tdk ya yg sdh dlm prodi yg pisah ilmu alquran tafsir ilmu hadis
728,sheikh dr muhammad bin yahya al ninowy madina institute usa prof dr amin abdullah mantan rektor uin sunan kalijaga indonesia prof dr amany lubis rektor uin syarif hidayatullah jakarta klink
729,sheikh dr muhammad bin yahya al ninowy madina institute usa prof dr amin abdullah mantan rektor uin sunan kalijaga indonesia prof dr amany lubis rektor uin syarif hidayatullah jakarta klink
730,sheikh dr muhammad bin yahya al ninowy madina institute usa prof dr amin abdullah mantan rektor uin sunan kalijaga indonesia klink
731,do kelas masjid kampus uin sunan kalijaga moga allah swt ampun dosa dosa bimbing sukses hidup dunia akhirat aamiin sunbksmp
732,kantor bupati lombok barat bupati rupa alumni uin sunan kalijaga yogyakarta makan khas lombok barat nyata beda makan tasikmalaya makan sehat indonesia
733,theater eska gelar pentas tajuk penjuru khayali gelanggang mahasiswa uin sunan kalijaga pagelaran theater kali rupa suguh kunjung tamu mahasiswa
734,rektor uin sunan kalijaga dukung ptkin go international
735,kelas diskusi minggu topik islam politik wacana bangsa najib kailani ph akademisi uin sunan kalijaga yogyakarta
736,senin universitas kebangsaaan malaysia unjung fakultas dakwah komunikasi fdk uin sunan kalijaga yogyakarta rombong sambut wakil dekan
737,nih dr media yg percaya kumpar catat dosen uin sunan kalijaga teliti meiliana
738,galih kharisma mega qoory dhianatika mahasiswa ilmu komunikasi fakultas ilmu sosial humaniora fishum uin sunan kalijaga raih juara acara komunikasi fiesta komfiest
739,lho mas arti nuduh pikir sempit jg kpd presiden wapres sklgs ketua dewan masjid indonesia ket pbnu ket pkb ket muhammadiyah waket dpr fahri hamzah ket mpr teliti ahli dr pusad paramadina kontras dosen uin sunan kalijaga yogyakarta dr iswandi dll
740,sosialisasi sbmptn amp um sm uin sunan kalijaga ugm uny upn isi sma wates yogyakarta rabu ayokuliahdiuinsuka uinsk uinsuka uinsunankalijaga uinjogja
741,maret uin sunan kalijaga gus nadirsyah hosen bedah buku saring sharing poin refleksi hasil bedah buku simak lengkap menujumasjid membudayakansujud literasimjs
742,materi sesi isi dr waryono ag wr arah bijak kembang mahasiswa uin sunan kalijaga
743,aji nur avianto aji mahasiswa prodi sosiologi fakultas ilmu soial humaniora uin sunan kalijaga program summit yangon myanmar maret aji
744,creative seminar amp talk show aduin creative advertising festival april gedung prof h soenarjo h convention hall jurus ilmu komunikasi fakultas ilmu sosial humaniora universitas islam negeri uin sunan kalijaga yogyakarta
745,jurnal inklusi bekerjasama pusat teliti lppm uin sunan kalijaga tawar beasiswa pena inklusi teliti kaji disabilitas didik inklusif info lengkap klik link sumber indbeasiswa beasiswa
746,terimakasih dosen uin sunan kalijaga terimakasih smada jaya terimakasih ibuk embak adik adik suami gani kconksumenep
747,aish aish mahasiswa ikomuinsuka ilmu komunikasi contoh ya gaess utama semangat fakultas ilmu sosial humaniora uin sunan kalijaga
748,selamat diah ajeng purwani dosen jurus komunikasi ilmu sosial humaniora uin sunan kalijaga yogyakarta hasil lulus doktor sekolah pascasarjana ugm prodi suluh
749,jogja daerah uin sunan kalijaga mati listrik yaaaa pinjem buku pustaka gak
750,vivanto pede ipe ribut kampanye yg serang partai islam simpatisan yg daerah kaum jg uin sunan kalijaga
751,nobar diskusi sexy killers sexy killers babak ekspedisi indonesia biru project dokumentasi sosial masyarakat lingkung watchdoc selasa april selesai gelanggang teater eska uin sunan kalijaga yogyakarta
752,sih malang uin jl sunan kalijaga sek tanyak no temen ku nama yak lupa sih anggota
753,kenal beliau rofiq salah dosen uin sunan kalijaga direktur lingkar studi qur an hadist pikir beliau rubah sudut pandang bidang agama ilmu
754,eksploitasi manusia akibat feedback buruk manusia tuhan salah saveearth gelanggang teater eska uin sunan kalijaga
755,rt majalahsm kammi uin sunan kalijaga kunjung suara muhammadiyah
756,kammi uin sunan kalijaga kunjung suara muhammadiyah
757,senat mahasiswa fakultas dakwah komunikasi uin sunan kalijaga seminar nasional kontestasi politik aspirasi kaum milenial kamis april gedung prof
758,gebyar pelangi milad fakultas ekonomi bisnis islam febi uin sunan kalijaga yogyakarta rupa rangkai acara lahir febi pasuk
759,siti aminah dosen prodi kembang masyarakat islam fakultas dakwah komunikasi uin sunan kalijaga yogyakarta rupa kepala laboratorium prodi pmi raih juara
760,uin sunan kalijaga
761,action plan temu sharing season psde cssmora nasional psde cssmora pt khusunya uin sunan kalijaga cssmora cssmoranasional monitoringpsde sharingsession psde pbsb
762,cinta jurus ambil kuliah simak tips tips bangun cinta jurus kuliah iin fitria mahasiswa jurus ilmu komunikasi uin sunan kalijaga yogyakarta weloveuin
763,repost support id muhammad iqbal fahkruddin faiz dosen filsafat uin sunan kalijaga
764,uin sunan kalijaga sugengambalwarsasrisultanhbx
765,jci jogja present futsal jci jogja feat wasaka kangen lantai sila futsal jci jogja selasa time wib gor uin sunan kalijaga yogyakarta htm buka member non member dresscode all about juventus grazie
766,postingan kammi uin sunan kalijaga
767,sugeng ambal warsa sri sultan hamengkubowono moga allah kah sehat tebar ikhlas bakti bina abdi islami publikasi humas media pramuka uin sunan kalijaga yogyakarta follow us on facebook ra
768,kangen pustaka uin sunan kalijaga yogyakarta uin yogyakarta
769,kuliah uin sunan kalijaga yogyakarta nanya jurus langsung ngomong waaaaah akh akh dooong idamaan mata
770,uin sunan kalijaga yogyakarta wakil dekan fishum moch sodik salah universitas laku penandatangan kerja kpi giat langsung menara pandang kalimantan selatan
771,uin sunan kalijaga focus group discussion fgd forum wakil rektor wakil ketua bidang administrasi rencana uang guru agama islam negeri ptkin
772,selamat libur mahasiswa uin sunan kalijaga yogyakarta ketemu semester oh iya agustus buka oprec ya tinggal see you jayalahselamalamanya
773,hmmmm perban syariah uin sunan kalijaga yogyakarta
774,rektor uin sunan kalijaga isi nuzulul qur an at taqwa balikpapan
775,selamat munaqosyahnya gus achmad mudzakki mabrur h uin sunan kalijaga yogyakarta ketua dewan nasihat moga berkah manfaat ilmu amiin
776,fidi adi rukmana lulus fakultas tarbiah iain sunan kalijaga baihaqi lulus fakultas usuluddin uin ar raniry banda aceh lolos cpns kemenag
777,assalamualaikum kait kurikulum prodi hukum islam pascasarjana uin sunan kalijaga cari website pasca sarjana mohon info berkas daftar beasiswa terimakasih
778,alhamdulilah cerpen judul aster mil juara lomba lpm paradigma uin sunan kalijaga yogyakarta
779,kriminologi ui psikologi uin sunan kalijaga
780,uin sunan kalijaga selenggara um ptkin
781,kunci motor ilang parkir lab agama uin sunan kalijaga yogyakarta lepas gantung sakuin
782,sore ngabuburit yogya kali acara launching diskusi buku khilafah ahmadiyah nation state uin sunan kalijaga live streaming
783,samping transmart ya sempet uin sunan kalijaga gak iaid tuh akuuu do ain do ain biar gak struggle udah tuju bantu do ain nih
