,content
0,selamat sukses lantik rakernas dpp ithla periode uin sunan kalijaga yogyakarta ithla ha ana dza video by dpw iii ithla jateng diy
1,isi pidato h said aqil siradj jg tanggap prof machasin giri uin sunan kalijaga nyata guru uin sunan kalijaga prof muhammad machasin kait pidato kiai said aqil siradj
2,ngegrab pulang rumah pikir emang uin nyata anter simpang sunan kalijaga karna pikir daerah situ sa ae mas
3,kaukus muda alumni uin sunan kalijaga yogyakarta deklarasi dukung jokowi klik
4,pidato kiai said potong pelintir guru uin sunan kalijaga angkat bicara
5,pidato kiai said potong pelintir guru uin sunan kalijaga angkat bicara
6,alumni uin sunan kalijaga yogya deklarasi dukung jokowi ma ruf
7,kaukus muda alumni uin sunan kalijaga yogyakarta deklarasi dukung jokowi maruf amin
8,pidato kiai said potong pelintir guru uin sunan kalijaga angkat bicara
9,pidato kiai said potong pelintir guru uin sunan kalijaga angkat bicara
10,pidato kiai sa id potong pelintir guru uin sunan kalijaga angkat bicara
11,pidato kiai said potong pelintir guru uin sunan kalijaga angkat bicara
12,kunjung kopri komisariat uin sunan kalijaga sahabat sahabat universitas bangsa malaysia in ketua kopri komisariat uin sunan kalijaga pusat pimpin wanita tun fathimah hasyim
13,pidato kiai sa id potong pelintir guru uin sunan kalijaga angkat bicara
14,pidato kiai said potong pelintir guru uin sunan kalijaga angkat bicara
15,resmi niafs network of indonesia and australian family studies prof dr h yudian wahyudi a ph rektor uin sunan kalijaga tampil angklung tari
16,pidato kiai said potong pelintir guru uin sunan kalijaga angkat bicara
17,jaya serah cindera mata foto mahasiswa universitas islam negeri uin sunan kalijaga yogyakarta
18,jaya sesi ky kunjung mahasiswa universitas islam negeri uin sunan kalijaga yogyakarta audiensi komisi yudisial rombong terima tenaga ahli ky totok wintarto auditorium ky selasa
19,pidato kiai said potong pelintir guru uin sunan kalijaga angkat bicara
20,pidato kiai said potong pelintir guru uin sunan kalijaga angkat bicara
21,pidato kiai said potong pelintir guru uin sunan kalijaga angkat bicara
22,air mancur barat masjid uin sunan kalijaga yogyakart uin uinsuka uinyogyakarta universitas islam
23,tau ku uin sunan kalijaga masuk lwt span ptkin gatau dehh
24,uin sunan kalijaga aja
25,cek seru agenda lengkap klik link bio ya fakultas ilmu sosial humaniora uin sunan kalijaga yogyakarta fishum muda fishum
26,kuliah uin sunan kalijaga yogyakarta
27,uin sunan kalijaga prnh anugerahkn gelar dr hc grand mufti suriah badruddin hasun dlm bid prdamaian dunia sy libat dlm mnyusun draf akademik helat dlm acr yg ee bbrp thn kmd libat prang suriah azyumardi abdillahtoha jahroni
28,thread kuliah hilang ambisi tdk lelah kejar mimpi gagal kuliah jepang jalur beasiswa gagal snmptn ipb gagal mandiri ui terima jalur sbmptn uin sunan kalijaga
29,fief ajidaffa ya gabisa yg bgni yg coreng nama uin sunan kalijaga
30,karateka indonesia ambil kejurnas karate sunan kalijaga cup xi inkai langsung gedung prof dr m amin abdullah uin sunan
31,pusat studi teknik industri center for industrial engineering study cefies fakultas sains teknologi uin sunan kalijaga malakukan program kembang produktifitas kualitas
32,belah jalan sunan kalijaga uin
33,selamat harigizinasional mahasiswa jaga sehat konsumsi makan imbang makan mi ya fakultas ilmu sosial humaniora uin sunan kalijaga yogyakarta
34,srawung gendhing uin sunan kalijaga via
35,ukm kalimasada uin sunan kalijaga via
36,mahasiswa ilmu komunikasi masuk ruang ngapain tanyaadmin fakultas ilmu sosial humaniora uin sunan kalijaga
37,mahasiswa sosiologi masuk ruang ngapain tanyaadmin fakultas ilmu sosial humaniora uin sunan kalijaga yogyakarta fishum
38,mahasiswa psikologi masuk ruang ngapain tanyaadmin fakultas ilmu sosial humaniora uin sunan kalijaga yogyakarta fishum
39,undip unej ugm um uin syarif hidayatullah uin sunan kalijaga nostalgia ama impi yg bentar aja gamasalah
40,laboratur agama masjid uin sunan kalijaga
41,buku rupa hasil disertasi doktoralnya tahan uin sunan kalijaga jogjakarta bahas buku
42,cieee kkn ya fakultas ilmu sosial humaniora uin sunan kalijaga yogyakarta fishum muda fishum muka follow us ig
43,bentar masuk kuliah nih sabar ken ketemu temen suara fakultas ilmu sosial humaniora uin sunan kalijaga yogyakarta fishum muda
44,uin sunan kalijaga kantor wilayah menteri agama diy senin adakan sosialisasi damping isi pdss snmptn sosialisasi helat aula gedung prof kh saifuddin zuhri uin sunan kalijaga yogyakarta
45,sosialisasi damping isi pangkal data sekolah siswa pdss snmptn aula gedung prof kh saifuddin zuhri uin sunan kalijaga yogyakarta senin buka rektor uin sunan kalijaga yudian wahyudi plt kakanwil edhi gunawan
46,liked video profil uin sunan kalijaga yogyakarta narasi bhs indonesia
47,gus dur jembatan temu lintas generasi cinta pluralitas bangsa indonesia alissa wahid tahlil bangsa uin sunan kalijaga jogja januari haulgusdur
48,suarabogor shared uin sunan kalijaga laku damping industri cor logam
49,twittizen shared uin sunan kalijaga laku damping industri cor logam
50,randa shared uin sunan kalijaga laku damping industri cor logam
51,ja share uin sunan kalijaga laku damping industri cor logam
52,uin sunan kalijaga laku damping industri cor logam
53,kisah orang tua mondok anak uin sunan kalijaga bangkitmedia
54,adi mohon ijin military strategy sun tzu strategi beda google kalo ktik sun tzu yg muncul strategi wikipedia trus youtube pnjlasanny dsen filsafat uin sunan kalijaga farudhin faiz filsafat sun tzu pakenya yg strategi tmkh
55,kisah orang tua mondok anak uin sunan kalijaga bangkitmedia
56,saiful islam jamaluddin profil uin sunan kalijaga yogyakarta
57,reputasi maju bangsa semangat optimisme pemuda dlm songsong saing global kreativitas cita bangsa pesan fachir mahasiswa uin sunan kalijaga inidiplomasi
58,uin sunan kalijaga yogyakarta wamenlufachir indonesia konsisten pegang teguh pd prinsip polugri bebas aktif jalan amanat konstitusi kontribusi wujud tertib dunia inidiplomasi
59,fact facts about me fangirl koriya koriyaan suka banget coklat cinta make up skincare kuliah semester jurus sastra inggris uin sunan kalijaga gamers doyan main pubg jual pulsa skincare bah
60,kamis happy pilih lagu karaoke day pustaka uin sunan kalijaga prof almakin dr anis masruri dr muhrisun dr witriyani rofah phd liana aisyah ma marwiyah mlis aning ayu kusuma
61,orang mahasiswa prodi ilmu pustaka uin raden fatah palembang kunjung pustaka uin sunan kalijaga
62,dasar kaji komunikasi non verbal prespektif calon pimpin yg malam laku debat capres cawapres persen paham pesan lisan persen gestur sisa ari tim sukses pakar komunikasi uin sunan kalijaga yk rama kerta mukti
63,prespektif pimpin dpt lihat gestur pandang mata tatap lawan bicara indikasi dengar terima amp telaah informasi posisi duduk samping lawan bicara indikasi egois kerja pakar komunikasi uin sunan kalijaga yk rama kerta
64,atlet atlet ukm taekwondo uin sunan kalijaga hasil emas amp perak ajang instiper taekwondo championship sabtu minggu januari juara
65,diy min cpns uin sunan kalijaga
66,atlet atlet ukm taekwondo uin sunan kalijaga hasil emas amp perak ajang instiper taekwondo championship sabtu minggu januari juara
67,international conference tema on re making indonesia challenges and opportunities januari uin sunan kalijaga yogyakarta ihtiar pikir negara indonesia negara daulat sepenuh
68,putri mala devianti mahasiswa prodi ilmu komunikasi fakultas ilmu sosial humaniora uin sunan kalijaga hasil harga ajang pilih putri
69,nyuwun tolong bek konco pean sing nemu dompet n wahyu joko tinggal juragan sambel jalan sunan kalijaga no area uin kasir dkk yg nemu temu unjung isi sim ac ktp atm uang rb kaya
70,selamat kenzuhri handini wijaya yg lolos cpns dosen uin sunan kalijaga yogyakarta moga sukses jalan profesi harap
71,tamu terimakasih izin siar lupa sunan kalijaga cup xi laksana tanggal januari multi purpose uin sunan kalijaga yogyakarta
72,lupa poin channel youtube pramuka uin sunan kalijaga yogyakarta ya kakak kakak cakep manis hati syukur syukur subscribe ngepoin ngga peka yakan yakan ikhlas bakti bina abdi islami publikasi
73,kalo jaman kampus uin sunan kalijaga duduk lingkar samping fakultas kali aktifitas kenal istilah jaga tradisi mazhab didik jogja hubung
74,segenap urus hmj bsa uin sunan kalijaga mohon pamit undur terima kasih kpd yg dukung slm urus moga urus amp hmjbsauinsuka bsauinsuka ithla
75,journal update jurnal supremasi hukum uin sunan kalijaga yogyakarta link
76,pontianak kota ulama terima konsep negara bangsa teliti ppim uin jakarta amp uin sunan kalijaga
77,bilang uin sunan kalijaga
78,makan malam rektor uin sunan kalijaga prof yudian royal ambarrukmo yogyakarta
79,tdk definisi ttg taoisme dngerin dosen uin sunan kalijaga fahruddin faiz ad segmen yg prtama
80,joo jer basuki mawa beya baca buku karang alumni uin sunan kalijaga kakang
81,suka video ukm kalimasada uin sunan kalijaga
82,breaking news alumni uin sunan kalijaga dukung jokowi
83,cisform uinsuka uin sunan kalijaga yogyakarta kerja ppim uin syarif hidayatullah jakarta mahasiswa program studi didik agama islam pandang perintah indonesia thaghut ideologiterlarang
84,cisform uin sunan kalijaga yogyakarta kerja ppim uin syarif hidayatullah jakarta mahasiswa program studi didik agama islam pandang perintah indonesia thaghut ideologiterlarang
85,tarbiyah salaf wahabi mahasiswa pai negara islam teliti center for the study of islam and social transformation cisform uin sunan kalijaga yogyakarta abdur rozaki
86,kejurnas karate sunan kalijaga cup xi daftar januari januari gedung prof m amin abdullah multi purpose uin sunan kalijaga yogyakarta tunggu ayoo download proposal
87,kembara gelar bhakti sosial keluarga mahasiswa banjarnegara kembara uin sunan kalijaga yogyakarta bhakti sosial rangka jalan program kerja dusun mertelu desa berta camat
88,kembara gelar bhakti sosial keluarga mahasiswa banjarnegara kembara uin sunan kalijaga yogyakarta bhakti sosial rangka jalan program kerja dusun mertelu
89,ayam goreng batik terang malioboro soto kudus uin sunan kalijaga
90,shanijkt kalo libur kerja kaya gitu ci oh iya kerja jogjakarta sd muhammadiyah sokonandi kuliah uin sunan kalijaga yogyakarta ambil jurus ilmu pustaka yg semangat ci shanijkt moga ketemu
91,kembara gelar bhakti sosial keluarga mahasiswa banjarnegara kembara uin sunan kalijaga yogyakarta bhakti sosial rangka jalan program kerja dusun mertelu
92,prof hasil teliti cisform uin sunan kalijaga kait guru pai
93,menag hasil teliti cisform uin sunan kalijaga yg dideseminasikan kemarin moga informasi manfaat
94,kepala pustaka labibah zain mlis serah cinderamata fatchul hijrih kom tugas staf si pustaka uin sunan kalijaga library award
95,tipe anggota ukm uin sunan kalijaga
96,sayur jelma uin sunan kalijaga
97,kulia uin sunan kalijaga yogyakarta nga kenal sayur haaaaasssshhh ramashoooook mop
98,uin sunan kalijaga pass
99,uin sunan kalijaga hasil tahan akreditasi institusi wartanasional wartapembaca
100,semester genap mahasiswa fakultas sains teknologi uin sunan kalijaga yogyakarta student mobility upa program transfer kredit fakultas sains
101,akreditasi institusi hasil tahan uin sunan kalijaga
102,akreditasi institusi hasil tahan uin sunan kalijaga
103,akreditasi institusi hasil tahan uin sunan kalijaga
104,akreditasi institusi hasil tahan uin sunan kalijaga
105,buang sampah ilm kpi uin sunan kalijaga via
106,terima serah mahasiswa magang januari fh uin sunan kalijaga jogjakarta dosen bimbing kejar sleman
107,pustaka uin sunan kalijaga terima piagam harga rektor uin sunan kalijaga unit sukses akreditasi uin sunan kalijaga uin yogya nilai akreditasi
108,pustaka uin sunan kalijaga undang dosen staf kelola program studi latih software plagiarism checker sert terima akun
109,seleksi duta kampus uin sunan kalijaga via
110,tuan guru haji had uin sunan kalijaga yogyakarta indonesia
111,tahan akreditasi uin sunan kalijaga yogyakarta gelar tasyakur
112,siang selasa lantai gedung prof rha soenarjo uin sunan kalijaga raya hasil rangka akreditasi berkat semangat kerja do
113,alhamdulillah donasi selat sunda ikat mahasiwa mang yogyakarta imamy uin sunan kalijaga rp pakai layak pakai terima baznas kota yogyakarta total donasi rp donasi muslim xinjiang uighur rp
114,nulis no caption udah pustaka uin sunan kalijaga
115,anglaras ilining banyu angali ananing ora keli serat lokakarya tuliaan masjid kampus uin sunan kalijaga yogyakarta
116,repost abdulloh badruzzaman get repost tari mahasiswa ppl uin sunan kalijaga
117,giat user education latih layan pustaka mahasiswa abdi unu yogyakarta isi mahasiswa ppl uin sunan kalijaga yogyakarta unujogjalib
118,sunan kalijaga cup ajang tunggu tunggu karateka penjuru indonesia sebentar hadir daftar atlet kontingen info fb inkai uin sunan kalijaga twitter ig acarajogja eventjogja
119,ikat keluarga alumni universitas islam negeri uin sunan kalijaga ikasuka yogyakarta wilayah jabodetabek unjung posko uin sultan maulana hasanudin smh banten donasi peduli korban bencana tsunami
120,sunan kalijaga cup ajang tunggu tunggu karateka penjuru indonesia sebentar hadir daftar atlet kontingen info fb inkai uin sunan kalijaga twitter ig blog
121,uin sunan kalijaga uin syarif hidayatullah psikologi sastra inggris aamiin
122,pustaka uin sunan kalijaga langgan database journal taylor amp francis group subjek psychology computer science akses jaring uin sk download judul jurnal
123,yogyakarta pagi guyur hujan deras surut semangat pimpin dosen tenaga didik uin sunan kalijaga upacara amal bhakti
124,sunan kalijaga uin grimis
125,indian cultural week icw buka pamer sejarah budaya islam india uin sunan kalijaga
126,tes seleksi beasiswa program magister doktor pmld pascasarjana uin sunan kalijaga kamis liput tes potensi akademik tpa bahasa inggris bahasa arab
127,mahasiswa jurus didik guru madrasah ibtidaiyah fakultas ilmu tarbiyah guru uin sunan kalijaga yogyakarta eko suhadinata dea amelia harits pilih
128,tesya nurintan mahasiswi prodi teknik informatika fakultas sains teknologi uin sunan kalijaga yogyakarta konferensi tingkat internasional ajang
129,besok gak uin sunan kalijaga yogyakarta
130,selamat tim mahasiswa program studi ilmu komunikasi hasil raih juara turnamen futsal uin sunan kalijaga langsung tanggal februari gor uin
131,dr faiz filsuf uin sunan kalijaga yogya indonesia maju wujud tdk mgkn capai bedua
132,lantik urus racana sunan kalijaga racana nyi ageng serang bakti ikhlas bakti bina abdi islami publikasi humas media pramuka uin sunan kalijaga yogyakarta follow us on facebook racana suka nas fansp
133,ida hadna pd wahyani mip isi user education mahasiswa pasca sarjana uin sunan kalijaga semester genap user education fokus akses sumber sumber
134,ketua dewan bina kaukus muda alumni uin sunan kalijaga yogyakarta syaiful bahri anshori pasang jokowi ma ruf rupa representasi kelompok nasionalis religius jokowirakyatbersatu
135,ketua kaukus muda alumni uin sunan kalijaga yogyakarta arif tongkeng gera alumni muda uin sunan kalijaga yogyakarta menang jokowi ma ruf amin pilpres jokowirakyatbersatu
136,kali kaukus muda alumni uin sunan kalijaga yogyakarta deklarasi dukung politik pasang jokowirakyatbersatu
137,kali alus hadir giat pustakawan plus sabtu februari diteatrikal pustaka uin sunan kalijaga yogyakarta tema tantang pustakawan era internet materi mukhlis ip
138,tolong info alfamart sunan kalijaga blkg uin dpt terima kasih
139,pasang jokowi kh ma ruf amin rupa duet ideal umara ulama nilai wakil umat islam alumni muda uin sunan kalijaga yogyakarta menang jokowirakyatbersatu sma
140,ketua dewan bina kaukus muda alumni uin sunan kalijaga yogyakarta syaiful bahri anshori pasang jokowi ma ruf rupa representasi kelompok nasionalis religius jokowirakyatbersatu sma
141,ketua kaukus muda alumni uin sunan kalijaga yogyakarta arif tongkeng gera alumni muda uin sunan kalijaga yogyakarta menang jokowi ma ruf amin pilpres capai ribu sma jokowirakyatbersatu
142,kuat pasang joko widodo ma ruf amin pilpres kali kaukus muda alumni uin sunan kalijaga yogyakarta deklarasi dukung politik pasang jokowirakyatbersatu sma
143,ketua dewan bina kaukus muda alumni uin sunan kalijaga yogyakarta syaiful bahri anshori bhw pasang jokowi ma ruf rupa representasi dr kelompok nasionalis religius dg kombinasi ideal dyakini bawa ubah amp kmajuan indonesia jokwirakyatbersatu
144,ketua kaukus muda alumni uin sunan kalijaga yogyakarta arif tongkeng gera alumni muda uin sunan kalijaga yogyakarta menang jokowi ma ruf amin pilpres capai ribu jokowirakyatbersatu
145,kuat pasang joko widodo ma ruf amin pilpres kali kaukus muda alumni uin sunan kalijaga yogyakarta deklarasi dukung politik pasang prp elyamani jokowirakyatbersatu
146,bismillahirrahmanirrahim segenap keluarga mahasiswa nahdatul ulama uin sunan kalijaga selamat lahir ipnu ippnu moga senantiasa
147,kuat pasang joko widodo ma ruf amin pilpres kali kaukus muda alumni uin sunan kalijaga yogyakarta deklarasi dukung politik pasang jokowirakyatbersatu
148,ketua dewan bina kaukus muda alumni uin sunan kalijaga yogyakarta syaiful bahri anshori pasang jokowi ma ruf rupa representasi kelompok nasionalis religius jokowirakyatbersatu
149,ketua kaukus muda alumni uin sunan kalijaga yogyakarta arif tongkeng gera alumni muda uin sunan kalijaga yogyakarta menang jokowi ma ruf amin pilpres jokowirakyatbersatu
150,kali kaukus muda alumni uin sunan kalijaga yogyakarta deklarasi dukung politik pasang jokowirakyatbersatu
151,pasang jokowi kh ma ruf amin rupa duet ideal umara ulama nilai wakil umat islam alumni muda uin sunan kalijaga yogyakarta menang jokowirakyatbersatu ldo
152,ketua dewan bina kaukus muda alumni uin sunan kalijaga yogyakarta syaiful bahri anshori pasang jokowi ma ruf rupa representasi kelompok nasionalis religius jokowirakyatbersatu ldo
153,ketua kaukus muda alumni uin sunan kalijaga yogyakarta arif tongkeng gera alumni muda uin sunan kalijaga yogyakarta menang jokowi ma ruf amin pilpres capai ribu jokowirakyatbersatu ldo
154,kuat pasang joko widodo ma ruf amin pilpres kali kaukus muda alumni uin sunan kalijaga yogyakarta deklarasi dukung politik pasang jokowirakyatbersatu ldo
155,pasang jokowi kh ma ruf amin rupa duet ideal umara ulama nilai wakil umat islam alumni muda uin sunan kalijaga yogyakarta menang jokowirakyatbersatu
156,ketua dewan bina kaukus muda alumni uin sunan kalijaga yogyakarta syaiful bahri anshori pasang jokowi ma ruf rupa representasi kelompok nasionalis religius jokowirakyatbersatu
157,ketua kaukus muda alumni uin sunan kalijaga yogyakarta arif tongkeng gera alumni muda uin sunan kalijaga yogyakarta menang jokowi ma ruf amin pilpres capai ribu jokowirakyatbersatu
158,kali kaukus muda alumni uin sunan kalijaga yogyakarta deklarasi dukung politik pasang jokowirakyatbersatu
159,kuat pasang joko widodo ma ruf amin pilpres kali kaukus muda alumni uin sunan kalijaga yogyakarta deklarasi dukung politik pasang jokowirakyatbersatu
160,pasang jokowi kh ma ruf amin rupa duet ideal umara ulama nilai wakil umat islam alumni muda uin sunan kalijaga yogyakarta menang jokowirakyatbersatu
161,ketua dewan bina kaukus muda alumni uin sunan kalijaga yogyakarta syaiful bahri anshori pasang jokowi ma ruf rupa representasi kelompok nasionalis religius jokowirakyatbersatu
162,ketua kaukus muda alumni uin sunan kalijaga yogyakarta arif tongkeng gera alumni muda uin sunan kalijaga yogyakarta menang jokowi ma ruf amin pilpres capai ribu jokowirakyatbersatu
163,kuat pasang joko widodo ma ruf amin pilpres kali kaukus muda alumni uin sunan kalijaga yogyakarta deklarasi dukung politik pasang jokowirakyatbersatu
164,kuat pasang joko widodo ma ruf amin pilpres kali kaukus muda alumni uin sunan kalijaga yogyakarta deklarasi dukung politik pasang jokowirakyatbersatu
165,kuat pasang joko widodo ma ruf amin pilpres kali kaukus muda alumni uin sunan kalijaga yogyakarta deklarasi dukung politik pasang jokowirakyatbersatu
166,kuat pasang joko widodo ma ruf amin pilpres kali kaukus muda alumni uin sunan kalijaga yogyakarta deklarasi dukung politik pasang jokowirakyatbersatu
167,kuat pasang joko widodo ma ruf amin pilpres kali kaukus muda alumni uin sunan kalijaga yogyakarta deklarasi dukung politik pasang jokowirakyatbersatu
168,kuat pasang joko widodo ma ruf amin pilpres kali kaukus muda alumni uin sunan kalijaga yogyakarta deklarasi dukung politik pasang jokowirakyatbersatu
169,ketua dewan bina kaukus muda alumni uin sunan kalijaga yogyakarta syaiful bahri anshori pasang jokowi ma ruf rupa representasi kelompok nasionalis religius jokowirakyatbersatu
170,alumni muda uin sunan kalijaga yogyakarta jokowirakyatbersatu
171,ketua kaukus muda alumni uin sunan kalijaga yogyakarta arif tongkeng gera alumni muda uin sunan kalijaga yogyakarta menang jokowi ma ruf amin pilpres jokowirakyatbersatu
172,kali kaukus muda alumni uin sunan kalijaga yogyakarta deklarasi dukung politik pasang jokowirakyatbersatu
173,kuat pasang joko widodo ma ruf amin pilpres kali kaukus muda alumni uin sunan kalijaga yogyakarta deklarasi dukung politik pasang jokowirakyatbersatu
174,kuat pasang joko widodo ma ruf amin pilpres kali kaukus muda alumni uin sunan kalijaga yogyakarta deklarasi dukung politik pasang jokowirakyatbersatu
175,kuat pasang joko widodo ma ruf amin pilpres kali kaukus muda alumni uin sunan kalijaga yogyakarta deklarasi dukung politik pasang jokowirakyatbersatu
176,kuat pasang joko widodo ma ruf amin pilpres kali kaukus muda alumni uin sunan kalijaga yogyakarta deklarasi dukung politik pasang jokowirakyatbersatu
177,kuat pasang joko widodo ma ruf amin pilpres kali kaukus muda alumni uin sunan kalijaga yogyakarta deklarasi dukung politik pasang jokowirakyatbersatu
178,kuat pasang joko widodo ma ruf amin pilpres kali kaukus muda alumni uin sunan kalijaga yogyakarta deklarasi dukung politik pasang jokowirakyatbersatu
179,kuat pasang joko widodo ma ruf amin pilpres kali kaukus muda alumni uin sunan kalijaga yogyakarta deklarasi dukung politik pasang jokowirakyatbersatu
180,kuat pasang joko widodo ma ruf amin pilpres kali kaukus muda alumni uin sunan kalijaga yogyakarta deklarasi dukung politik pasang jokowirakyatbersatu
181,kuat pasang joko widodo ma ruf amin pilpres kali kaukus muda alumni uin sunan kalijaga yogyakarta deklarasi dukung politik pasang jokowirakyatbersatu
182,kuat pasang joko widodo ma ruf amin pilpres kali kaukus muda alumni uin sunan kalijaga yogyakarta deklarasi dukung politik pasang jokowirakyatbersatu
183,kuat pasang joko widodo ma ruf amin pilpres kali kaukus muda alumni uin sunan kalijaga yogyakarta deklarasi dukung politik pasang jokowirakyatbersatu
184,kuat pasang joko widodo ma ruf amin pilpres kali kaukus muda alumni uin sunan kalijaga yogyakarta deklarasi dukung politik pasang jokowirakyatbersatu
185,kuat pasang joko widodo ma ruf amin pilpres kali kaukus muda alumni uin sunan kalijaga yogyakarta deklarasi dukung politik pasang jokowirakyatbersatu
186,kuat pasang joko widodo ma ruf amin pilpres kali kaukus muda alumni uin sunan kalijaga yogyakarta deklarasi dukung politik pasang jokowirakyatbersatu
187,kuat pasang joko widodo ma ruf amin pilpres kali kaukus muda alumni uin sunan kalijaga yogyakarta deklarasi dukung politik pasang jokowirakyatbersatu
188,kuat pasang joko widodo ma ruf amin pilpres kali kaukus muda alumni uin sunan kalijaga yogyakarta deklarasi dukung politik pasang jokowirakyatbersatu
189,kuat pasang joko widodo ma ruf amin pilpres kali kaukus muda alumni uin sunan kalijaga yogyakarta deklarasi dukung politik pasang jokowirakyatbersatu
190,kuat pasang joko widodo ma ruf amin pilpres kali kaukus muda alumni uin sunan kalijaga yogyakarta deklarasi dukung politik pasang jokowirakyatbersatu luphy
191,bincang cadar seteru uin sunan kalijaga sikap cadar
192,seminar series lengkap klik link bio gaess fakultas ilmu sosial humaniora uin sunan kalijaga yogyakarta fishum muda fishum muka follow us
193,narasumber kali kupas candah mln bilal ahmad bonyan ahsin nal mustafa h m mahasiswa doktoral uin sunan kalijaga chaitime candah bukticintaku
194,jl sunan kalijaga alfamart blkg uin malang jatim muacettt gagara gorong gorong hrsnya kerja paro laaahhh
195,luncur majalah arena sektor informal jumat februari wib gedung convention hall ch lantai uin sunan kalijaga acara gratis sedia majalah ganti ongkos cetak
196,mi sirojul ulum mtsn model pare man kota ex man uin sunan kalijaga
197,luncur majalah arena sektor informal tanggal jumat februari wib gedung convention hall ch lantai uin sunan kalijaga acara gratis sedia majalah ganti ongkos cetak
198,audiensi program pendidikanuntuksemua uin sunan kalijaga yogyakarta
199,uin sunan kalijaga sedia kuota program sarjana cc
200,rt tribunjogja uin sunan kalijaga yogyakarta gelar latih biogas ternak kandang kelompok
201,uin sunan kalijaga yogyakarta gelar latih biogas ternak kandang kelompok
202,workshop kembang kurikulum prof dr sutrisno wakil rektor uin sunan kalijaga alam iain palopo workshop kurikulum didik
203,workshop kembang kurikulum prof dr sutrisno wakil rektor uin sunan kalijaga alam iain palopo workshop kurikulum didik
204,bedah buku manusia rohani uin sunan kalijaga live streaming
205,bedah buku manusia rohani meditasi meditasi ibnu athaillah kitab al hikam karya gus pagi uin sunan kalijaga yogyakarta
206,kuliah univ kak me uin sunan kalijaga del oh situ tah fakultas ap kak me ilmu sosial humabiora bagusss dongg denger
207,uin sunan kalijaga buka terima mahasiswa jalur span um
208,maaf postingan kak lokasi lantik sih ngga lokasi tetep semangat proses ikhlas bakti bina abdi islami publikasi humas media pramuka uin sunan kalijaga yogyaka
209,jalan sapen uin sunan kalijaga drama singgah gak tau jogja kabar taun doang gak kesana lebay
210,uin sunan kalijaga buka terima mahasiswa jalur span um
