,content
1243,uin sunan kalijaga tuntut website sistem informasi akademik uin sunan kalijaga tandatangani petisi via id
1244,dirs rektor uin sunan kalijaga yogyakarta prof drs h yudian wahyudi a ph dosen muda fakultas dakwah komunikasi rian tegak pancasila uud tangkal radikalisme indonesia islam yes khilafah no ri
1245,rektor uin sunan kalijaga rektor mu
1246,kebahagianku sederhana tani makan wakil rektor uin sunan kalijaga
1247,cm gais maba psikologi uin sunan kalijaga jogja utama yg masuk jalur pbt milih tugas ospek pliss rep this tweet
1248,kkn uin sunan kalijaga rintis wisata laut pulau kiluan lampung
1249,hut ri segenap keluarga jamaah al khidmah uin sunan kalijaga yogyakarta dirgahayu republik indonesia yg moga maju tuju indonesia unggul bangsa
1250,sumber literatur link unduh abrori model matematika anarkisme demo mahasiswa uin sunan kalijaga yogyakarta solusi tinjau matematika jurnal fourier vol no
1251,ag mahasiswa uin sunan kalijaga gila bener bener gila
1252,mahasiswa uin sunan kalijaga gila bener bener gila
1253,mahasiswa uin sunan kalijaga gila bener bener gila
1254,rlthingy uin sunan kalijaga jogja
1255,job fair uin sunan kalijaga september
1256,assalamualaikum ayah bunda kenal risma alda gunawan selesai studi uin sunan kalijaga piaud alif iqra ruang
1257,zakie kopma uin sunan kalijaga yogyakarta
1258,kelompok kuliah kerja nyata kkn tematik ladang pindah loksado universitas islam negeri uin sunan kalijaga yogyakarta hasil kumpul salur buku loksado bawa langsung
1259,rektor uin sunan kalijaga lontar kritik hadap nyata menristekdikti profesor tua duniadosen dosenindonesia infodosen profesortua kritikmenristekdikti
1260,alam dosen sosiologi didik universitas islam negeri uin sunan kalijaga zain terang firehose of falsehood milik arti sembur tekan propaganda palsu
1261,tim kkn uin sunan kalijaga yogyakarta pasang qr code tanam langka obyek wisata gunung api purba nglanggeran gunungkidul
1262,tim kkn uin sunan kalijaga yogyakarta pasang qr code tanam langka obyek wisata gunung api purba nglanggeran gunungkidul
1263,tim kkn uin sunan kalijaga yogyakarta pasang qr code tanam langka obyek wisata gunung api purba nglanggeran gunungkidul
1264,tim kkn uin sunan kalijaga yogyakarta pasang qr code tanam langka obyek wisata gunung api purba nglanggeran gunungkidul
1265,tim kkn uin sunan kalijaga yogyakarta pasang qr code tanam langka obyek wisata gunung api purba nglanggeran gunungkidul
1266,cm anak uin sunan kalijaga ga sih
1267,popro pojok propagandis islam prasmanan vivisualiterasi com viral mahasiswa fakultas dakwah komunikasi uin sunan kalijaga yogyakarta gaung opini islam yes khilafah no
1268,popro pojok propagandis islam prasmanan vivisualiterasi com viral mahasiswa fakultas dakwah komunikasi uin sunan kalijaga yogyakarta gaung opini islam yes khilafah no giat pbak kenal budaya
1269,popro pojok propagandis islam prasmanan viral mahasiswa fakultas dakwah komunikasi uin sunan kalijaga yogyakarta gaung opini islam yes khilafah no giat pbak
1270,mahasiswi aceh lulus cepat uin sunan kalijaga jeumpanews
1271,skuy kak susul semangat proses ikhlas bakti bina abdi islami publikasi humas media pramuka uin sunan kalijaga yogyakarta follow us on facebook racana suka nas fanspage gera pramuka uin sunan kalijaga yogyakar
1272,assalamualaikum gus njenengan slogan islam yes khilafah no twibbon fdk uin sunan kalijaga viral nggeh sanjung maba fdk kulonuwun pendapate panjenengan doyo
1273,mahasiswi aceh lulus cepat uin sunan kalijaga
1274,gus dirs uin sunan kalijaga rame tag line twibon teman panitia pbak fakultas dy fdk saran teman teman panitia ngundang gus nadir materi hehe semangat panitia
1275,penandatanganan janji kerjasama pks pustaka uin sunan kalijaga yogyakarta universitas trunojoyo madura uinsukalib perpusuinsuka
1276,pasu tot user education pustaka uin sunan kalijaga
1277,jaksa i yogyakarta nara sumber acara focus group discussion fgd terang hukum uin sunan kalijaga yogyakarta ambil tema barang jasa rabu
1278,indonesia siaga nasionalisme hafidz nur ockta mahasiswa uin sunan kalijaga yogyakarta lengkap follow us facebook kisp id twitter id instagram id website suarakantulisanmu hutri indonesiamaju
1279,uswatun hasanah buang buang studi uswah fokus ajar tempuh program studi magister hukum islam fakultas syariah uin sunan kalijaga yogyakarta
1280,kkn uin sunan kalijaga cipta qr code tanam cyber news
1281,mahasiswa kkn uin sunan kalijaga cipta qr code tanam wisata gunung api purba nglanggeran
1282,tribun jogja mahasiswa kkn uin sunan kalijaga cipta qr code tanam wisata gunung api purba nglanggeran
1283,mahasiswa kkn uin sunan kalijaga cipta qr code tanam wisata gunung api purba nglanggeran
1284,mahasiswa kkn uin sunan kalijaga cipta qr code tanam wisata gunung api purba nglanggeran
1285,htm mahasiswa uin sunan kalijaga rp gelombang agustus rp gelombang ii september rp ots rp how to join online bni n yunia tri puspitasari
1286,save the date minggu september selesai convention hall lt uin sunan kalijaga fasilitas ilmu manfaat sertifikat seminar kit snack makan siang doorprize
1287,mahasiswa kimia uin sunan kalijaga proudly present seminar nasional optimalisasi sumber daya alam kembang energi wawas lingkung tuju tahan energi nasional narasumber prof drs karna wijaya eng dr rer nat
1288,jago neon team pustaka uin sunan kalijaga
1289,selamat adik adik terima uin sunan kalijaga semangat langkah lupa mapaba ya biar nambah alam
1290,htm mahasiswa uin sunan kalijaga rp gelombang agustus rp gelombang ii september rp ots rp how to join online bni n yunia tri puspitasari
1291,special performence elfariziee acoustic cover save the date minggu september selesai convention hall lt uin sunan kalijaga fasilitas ilmu manfaat sertifikat seminar kit snack makan siang doorprize
1292,mahasiswa kimia uin sunan kalijaga proudly present seminar nasional optimalisasi sumber daya alam kembang energi wawas lingkung tuju tahan energi nasional
1293,kritik yudian hadap nasir berang prof yudian wahyudi rektor uin sunan kalijaga lontar kritik nasir rencana impor rektor asing tanggung ilmiah ide mesti tolak baca rektorasing
1294,hmps kimia uin sunan kalijaga selamat raya idul adha dzulhijjah departemen jurnalistik media hmps kimia uin sunan kalijaga hmpskimiauinsuka com
1295,chemistry festival and competition okisuka olimpiade kimia sunan kalijaga haiii generasi cerdas bangsa mahasiswa kimia uin sunan kalijaga yogyakarta hadir olimpiade kimia tingkat ajar
1296,chemistry festival and competition lomba poster mahasiswa kimia uin sunan kalijaga yogyakarta sembah lomba poster diy jateng buka usia karya
1297,happy eid mubarak idul adha loc masjid uin sunan kalijaga
1298,masyarakat polda diy ramai sholat idul adha halaman mapolda diy tindak imam khotib dr waryono abdul ghafur wakil rektor bidang mahasiswa kerja uin sunan kalijaga yogya
1299,bangun kampus ii uin sunan kalijaga laku proses lepas lahan pajang bantul
1300,wadooohh yudi btw lu uin sunan kalijaga may
1301,syukur banget alumni uin sunan kalijaga alumni situ kampus putih pure juang militan aktivis idealis
1302,paviliun lokasi tegaltirto kec bah kabupaten sleman daerah istimewa yogyakarta km bandara adi sucipto km atma jaya babarsari km uin sunan kalijaga harga rp
1303,tolak snmptn uns snmptn unnes vokasi ugm vokasi undip usm stan kali snmptn uin sunan kalijaga terima sbmptn uns
1304,dirs sholat ied masjid sunan kalijaga khatib dr phil sahiron warek uin sunan kalijaga salah yg mnarik adl nabi ibrahim mminta ismail ttg mimpi nilai yg ambil adl mngedepankan dialogis paksa
1305,sholat jamaah masjid uin sunan kalijaga yogyakarta
1306,mahasiswa prestasi uin sunan kalijaga terima piagam harga rektor acara wisuda periode iv a kamis agustus ayi muthi nahdiyanti fakultas sains teknologi juara lomba
1307,bangun gasik gaesss sholat idul adha laboratorium agama masjid uin sunan kalijaga masjiduinsuka jogja uinsk uinsuka uinsunankalijaga humasuinsuka sukainfo masjiduinsuka sholateid iduladha
1308,bangun gasik gaesss sholat idul adha laboratorium agama masjid uin sunan kalijaga uinsk uinsuka uinsunankalijaga humasuinsuka sukainfo masjiduinsuka sholateid iduladha
1309,rektor uin sunan kalijaga prof drs h yudian wahyudi wakil rektor bidang mahasiswa kerjasama dr waryono damping handaroh yudian wahyudi hewan qurban
1310,ajar kisah ismail rela sembelih ibrahim ikhlas sembelih nama allah tiada cinta banding cinta segenap keluarga pmii rayon wisma tradisi uin sunan kalijaga selamat raya idul adha
1311,alhamdulillahirobbil alamin anggota keluarga liaherni yogyakarta yogyakartaistimewa uinsk uinsunankalijaga uin sunan kalijaga yogyakarta
1312,eid al adha segenap keluarga jamaah al khidmah uin sunan kalijaga yogyakarta selamat raya idul adha ikhlas pasrah moga teladan
1313,mari gabung mari gabung jamaah al khidmah uin sunan kalijaga yogyakarta info alkhidmahuinsuka ig fb twitter whatsapp alkhidmahuinsuka com email tuju integrasi dzikir fikir salam oase dunia
1314,selamat maba jamaah al khidmah uin sunan kalijaga yogyakarta selamat mahasiswa mahasiswi uin sunan kalijaga yogyakarta moga sukses hasil mudah tuntut ilmu aminn
1315,keluarga pustaka uin sunan kalijaga selamat raya idul adha moga amal laku sambut raya berkah allah swt
1316,tuju pernyatan rektor uin sunan kalijaga tsb contoh skrg lihat deh ekspatriat us indonesia tdk ekspat kerja sekian ekspat tsb agen cia awas poleksosbudhankam negara
1317,analisa putar pro kontra impor dosen tinjau aspek didik amp ekonomi kaji dampak politis potensi ancam aman negara rektor uin sunan kalijaga tolak niat menristekdikti rektor impor
1318,beritaislam rektor uin sunan kalijaga tolak niat menristekdikti rektor impor
1319,media balance rektor uin sunan kalijaga tolak niat menristekdikti rektor impor eram eramuslim
1320,assalamualaikum wr wb kenal mahasiswa uin sunan kalijaga giat kuliah kerja nyata dusun soka desa hargowilis camat kokap kulon progo
1321,forum rektor ptkin bantah fgd uin sunan kalijaga yogyakarta usul nama rektor ptkin calon menteri agama calonmenteri
1322,ahli agama ya uin sunan kalijaga smh
1323,kamis piagam terima kasih kkn uin sunan kalijaga direktur mitra wacana kerjasama magang magangmitrawacana mitrawacana
1324,wajah wajah ceria mahasiswa prestasi terima harga rektor uin sunan kalijaga wisuda periode iv a rabu shalehuddin rahmat fak syar ah hukum juara debat bahasa
1325,uin sunan kalijaga yogyakarta buka prodi fakultas
1326,protes rektor uin sunan kalijaga rencana rektor asing yogyakarta jogjakarta jogja beritaviral beritaterkini berita viralindonesia viralindo viral
1327,didu tuju rektor uin sunan kalijaga tp khawatir didu moga rektor copot vokal
1328,fishum kuat jaring istanbul zaim university optimal internasionalisasi program fakultas ilmu sosial humaniora fishum uin sunan kalijaga kuat jejaring laku kerja
1329,the st international conference on islamic guidance and counseling tema islamic counseling without border selesai selenggara november convention hall building uin sunan kalijaga yogyakarta salah presenter
1330,uin sunan kalijaga wisuda mahasiswa
1331,kost putra lokasi gang telasih nologaten condongcatur kec depok kabupaten sleman daerah istimewa yogyakarta km atma jaya hukum km uin sunan kalijaga km sanata dharma
1332,gelombang ii syukur lulus masuk uin sunan kalijaga ga ngekos tp suruh masuk ponpes wahid hasyim sleman ajar gapernah ngijinin deket ma cwek pacar ibukku jg gitu adekku emang manja bat hahaa
1333,nasir ngerti utama masuk universitas dunia rektor uin sunan kalijaga prof yudian wahyudi rektorasing
1334,mahasiswa uin sunan kalijaga sosialisasi tanggap bencana momentum
1335,kali uin sunan kalijaga yogyakarta lulus orang sarjana rincian orang lulus orang lulus orang lulus laksana upacara wisuda laku
1336,rektor uin sunan kalijaga yogyakarta yudian wahyudi tantang menristekdikti nasir adu kalah mundur rektor menristekdikti rektoruinyogya
1337,fakultas ilmu sosial humaniora fishum uin sunan kalijaga milik doktor muda senin juli sidang buka promosi doktor ilmu geografi program pasca sarjana ilmu geografi fakultas
1338,keluarga kammi uin sunan kalijaga innalillahi wa inna ilaihi rajiun allahummaghfirlahu waafihi wa fuanhu duka cita tinggal ayahanda kh maimoen zubair moga terima
1339,rektor uin sunan kalijaga yogyakarta prof drs kh yudian wahyudi ba ba ma ph usia pikir orang profesor maju negara
1340,optimal internasionalisasi program fakultas ilmu sosial humaniora fishum uin sunan kalijaga kuat jejaring laku kerja istanbul zaim university izu wakil dosen fishum
1341,belah prof yudian rektor uin sunan kalijaga yogyakarta beliau nasihat masuk kerja sangka beliau cerdas suka canda
1342,prodi manajemen dakwah uin sunan kalijaga konsentrasi manajemen lembaga uang islam manajemen sumber daya manusia manajemen haji amp umrah selamat wisuda kamis yaaa jaga sehat
1343,duta genre diy juara putra ilham assagaf pik remaja aushaf uii putri ziadatul fauzia pik remaja lingkar seroja uin sunan kalijaga
1344,kamis wakil dosen bimbing lapang kkn tanggap bencana uin sunan kalijaga kunjung pemkab tanggamus giat laku laksana monitoring mahasiswa kkn tanggap bencana
1345,catat the st international confrence on islamic guidance and counseling uin sunan kalijaga yogyakarta
1346,sosialisasi kenal askrindo sosialisasi kredit usaha rakyat bunga rebdah agenda bekerjasama sabtrifersitas teatrikal pustaka uin sunan kalijaga yogyakarta
1347,kost putra lokasi plumbon sanggrah banguntapan yogyakarta km akakom km ust amp apmd timoho km uty km uin sunan kalijaga km uad kampus km unriyo
1348,pek ngaji filsafat dekonstruksi jacques derrida dr fahruddin faiz uin sunan kalijaga masjid jendral sudirman yogyakarta cinta sejati ramah sejati syarat
1349,pripun nik didu rektor uin sunan kalijaga kritik menristekdikti
1350,menristekdikti kritik rektor uin sunan kalijaga net
1351,rektor uin sunan kalijaga yogyakarta yudian wahyudi sayang sweeping buku nilai ajar marxisme makassar
1352,om coba setorfoto xiaomi redmi masjid uin sunan kalijaga
1353,upz uin sunan kalijaga salur air bersih gunungkidul
1354,thread mahasiswa kkn assalamu alaikum wr wb mahasiswa kkn uin sunan kalijaga yogyakarta niat bangun mandi cuci kakus mck dusun karang wetan salah view dusun karang wetan
1355,aulya nidaur rahmah mahasiswi prodi biologi fakultas sains teknologi uin sunan kalijaga yogyakarta pilih wakil diy kapal pemuda nusantara kpn giat langsung
1356,mahasiswa prodi biologi didik biologi fakultas sains teknologi uin sunan kalijaga raih harga jambore capung indonesia iii jambore angkat tema capung upaya
1357,hallo girl lomba hijab show dewasa student fair save the date rabu september lokasi gedung prof amin abdullah multi purpose uin sunan kalijaga yogyakarta maps syarat
1358,cm halo maba uin sunan kalijaga yogyakarta kemaren terima jalur pbt mandiri
1359,tau hymnenya doang wkwk uin sunan kalijaga ga apal lirik
1360,pek ngaji filsafat tuhan mati nietzsche dr fahruddin faiz uin sunan kalijaga masjid jendral sudirman yogyakarta agama bikin kecut bikin larindari nyata
1361,prof dr h suryadi guru ilmu hadis uin sunan kalijaga tutup usia
1362,chemistry festival and competition lomba poster mahasiswa kimia uin sunan kalijaga yogyakarta sembah lomba poster diy jateng buka usia karya
1363,seminar amp bedah buku rekonstruksi adab islam perspektif yudian wahyudi uin sunan kalijaga yogyakarta gedung prof soenarjo lt jl laksda adisucipto papringan caturtunggal kec depok kabupaten sleman i yogyakarta senin agustus wib
1364,assalamualaikum wr wb himpun mahasiswa program studi psikologi fakultas ilmu sosial humaniora uin sunan kalijaga yogyakarta proudly present latih kiat human resource development hrd
1365,umroh haji mudah lo pusat ambang bisnis uin sunan kalijaga yogyakarta jamin amanah uinsuka uinsk uinjogja uinsunankalijaga umroh haji tourtravel humasuinsuka
1366,upz uin sunan kalijaga salur air bersih daerah gunungkidul kulonprogo
1367,upz uin sunan kalijaga salur air bersih daerah gunungkidul kulonprogo
1368,jogja upz uin sunan kalijaga salur air bersih daerah gunungkidul kulonprogo
1369,jogjanews upz uin sunan kalijaga salur air bersih daerah gunungkidul kulonprogo
1370,pek ngaji filsafat orkestra alam dr fahruddin faiz uin sunan kalijaga masjid jendral sudirman yogyakarta rumput pohon angin ombak burung fauna nyanyi
1371,cm krs uin sunan kalijaga error ya
1372,kidjang coffee nde mburi uin jalan simpang sunan kalijaga
1373,halo sahabat mji member prestasi kali mahasiswi uin sunan kalijaga yogyakarta nama fahmi ana ulfa kak ana gabung lho total hasil capai juta wow
1374,pek ngaji filsafat alim al ghazali dr fahruddin faiz uin sunan kalijaga masjid jendral sudirman yogyakarta alim masuk kelompok intelektual tanggung sosial
1375,kepadaaa teman teman semuaaaa harap hadir uin sunan kalijaga ugm gejayan panggil gejayanmemanggil reformasidikorupsi
1376,assalamu alaikum sobat abu bakar sabtu september smpit abu bakar fullday school giat dauroh qur an laboratorium agama masjid uin sunan kalijaga yogyakarta giat dauroh
1377,rabu laksana galang dana saudara riau kalimantan selenggara departemen m cssmora uin sunan kalijaga yogyakarta cssmora cssmoranasional galangdana cssmorauinsuka pbsb
1378,segenap keluarga cssmora nasional selamat anggota cssmora uin sunan kalijaga yogyakarta sdra nuzul fitriansyah angkat sdri rachma vina tsurayya angkat juara iii giat call for paper jateng diy cssmora
1379,pamer manuskrip joglitfest september lobby pustaka uin sunan kalijaga jl adi sucipto demang gondokusuman info fest
1380,uin sunan kalijaga kukuh sangkot sirait guru bidang ilmu kalam
1381,senam anggota karyawan kopma uin sunan kalijaga
1382,senam anggota karyawan kopma uin sunan kalijaga
1383,prinsip rektorat uin sunan kalijaga yogyakarta kait larang cadar lingkung kampus luluh lantak
1384,pamer manuskrip joglitfest september lobby pustaka uin sunan kalijaga jl adi sucipto demang gondokusuman info fest
1385,min kosan air pdam ga lg daerah uin malang jl simpang sunan kalijaga poster edar tera alamat knpa yaa terimakasih
1386,lomba tata upacara bendera siswa ma sma smk tingkat nasional mention pasu gas aksi rebut piala rektor uin sunan kalijaga total hadiah juta
1387,tantang tinggal berani hadap tantang temansurya fmsurya broadcasting crew sukatv fakultas dakwah uin sunan kalijaga
1388,keluarga kammi uin sunan kalijaga innalillahi wa inna ilaihi rajiun allahummaghfirlahu waafihi wa fuanhu duka cita gugur immawan randi aksi tolak ruu kantor dprd
1389,kepala pustaka uin sunan kalijaga dra labibah zain mlis sambut giat diskusi dokumen budaya lokal event jogjalitfest uinsukalib perpusuinsuka jogjalitfest
1390,pamer manuskrip joglitfest september lobby pustaka uin sunan kalijaga jl adi sucipto demang gondokusuman info fest
1391,terimakasih pus uin sunan kalijaga jogja tour pulau ribu jakarta labiru tour hub tour advisor cs com
1392,diskusi joglitfest dokumentasi budaya lokal era milenial dyah puspitasari amp irfan afifi jumat sept pustaka uin sunan kalijaga gratis amp buka info amp daftar nuri fest
1393,pamer manuskrip joglitfest september lobby pustaka uin sunan kalijaga jl adi sucipto demang gondokusuman info fest
1394,assalamualaikum wr wb manajemen uang syariah uin sunan kalijaga yogyakarta proudly present sharia finance expo th tema pekan literasi uang syariah gali potensi kenal lingkung
1395,aksi kumpul massa long march titik kumpul bunderan ugm uin sunan kalijaga universitas sanata dharma tuju colombo gejayan
1396,kampus kampus yogyakarta kayak ugm sanata dharma uin sunan kalijaga uny kompak cegah mahasiswa turun jalan bilang nggak dukung aksi
1397,konselor budaya duta iran jakarta mehrdad rakhshandeh uin sunan kalijaga diskus putar aktif iranian corner kunjung iranian corner pustaka uin sunan
1398,nasyid wathaniy om lembut national anthem of om students uin sunan kalijaga indonesia
1399,contoh diplomacy publik mahasiswa uin sunan kalijaga national anthem of somalia qolobaa calankeed
1400,contoh public diplomacy mahasiswa uin sunan kalijaga moroccan national anthem by indonesian students at state islamic univer
1401,alhamdulillah september uin sunan kalijaga ulang syukur lahir kali uin sunan kalijaga angkat tema peran didik erat
1402,titik kumpul uin sunan kalijaga bundar ugm kampus sanata dharma mahasiswa laku long march tuju daerah gejayan siang
1403,titik kumpul uin sunan kalijaga bundar ugm kampus sanata dharma mahasiswa laku long march tuju daerah gejayan siang
1404,titik kumpul uin sunan kalijaga bundar ugm kampus sanata dharma mahasiswa laku long march tuju daerah gejayan siang
1405,titik kumpul uin sunan kalijaga bundar ugm kampus sanata dharma mahasiswa laku long march tuju daerah gejayan siang
1406,diskusi joglitfest dokumentasi budaya lokal era milenial dyah puspitasari amp irfan afifi jumat sept pustaka uin sunan kalijaga gratis amp buka info amp daftar nuri fest
1407,pamer manuskrip joglitfest september lobby pustaka uin sunan kalijaga jl adi sucipto demang gondokusuman info fest
1408,halo sahabat mji member prestasi kali mahasiswi uin sunan kalijaga yogyakarta nama kak fahmi ana ulfa kak ana gabung lho total hasil capai juta rupiah wow ken kak ana yukk join klik link bio
1409,pustaka uin sunan kalijaga pamer manuskrip wib diskusi manuskrip wib hotel cavinton workshop tata kelola manajemen komunitas wib
1410,diskusi joglitfest dokumentasi budaya lokal era milenial dyah puspitasari amp irfan afifi jumat sept pustaka uin sunan kalijaga gratis amp buka info amp daftar nuri fest
1411,pamer manuskrip joglitfest september lobby pustaka uin sunan kalijaga jl adi sucipto demang gondokusuman info fest
1412,acara rupa program kreativitas pemuda gelar kampus uin sunan kalijaga yogyakarta september
1413,coba demo revolusi uin sunan kalijaga jogja sultan perintah polisi santun hadap demo aman ketat baracuda water canon polisi leyeh pinggir jalan pantau demonstran bubar tertib orasi polisi
1414,alumni titi didik uin sunan kalijaga yogyakarta mugi lancar aamiin
1415,diskusi joglitfest dokumentasi budaya lokal era milenial dyah puspitasari amp irfan afifi jumat sept pustaka uin sunan kalijaga gratis amp buka info amp daftar nuri fest
1416,pamer manuskrip joglitfest september lobby pustaka uin sunan kalijaga jl adi sucipto demang gondokusuman info fest
1417,ukm taekwondo dojang uin sunan kalijaga yogyakarta present come join us kejurtas juara fakultas kejurtas rupa salah event selenggara unit giat
1418,diskusi joglitfest dokumentasi budaya lokal era milenial dyah puspitasari amp irfan afifi jumat sept pustaka uin sunan kalijaga gratis amp buka info amp daftar nuri fest
1419,pamer manuskrip joglitfest september lobby pustaka uin sunan kalijaga jl adi sucipto demang gondokusuman info fest
1420,sapa fakultas ilmu sosial humaniora uin sunan kalijaga jogjakarta
1421,mahasiswa uai tuai prestasi festival bahasa budaya uin sunan kalijaga tingkat nasional
1422,mahasiswa uai tuai prestasi festival bahasa budaya uin sunan kalijaga tingkat nasional
1423,fyi pict pas aksi gejayanmemanggil temen temen uin sunan kalijaga orasi
1424,diskusi joglitfest dokumentasi budaya lokal era milenial dyah puspitasari amp irfan afifi jumat september wib pustaka uin sunan kalijaga gratis buka informasi amp daftar nuri
1425,halo guys suka futsal nih suara kabar loh teman teman rangka dies natalis fakultas ushuluddin pikir islam uin sunan kalijaga dewan eksekutif
1426,laksono inimah ambil jembatan integrasi interkoneksi uin sunan kalijaga
1427,diskusi joglitfest dokumentasi budaya lokal era milenial dyah puspitasari amp irfan afifi jumat sept pustaka uin sunan kalijaga gratis amp buka info amp daftar nuri fest
1428,pamer manuskrip joglitfest september lobby pustaka uin sunan kalijaga jl adi sucipto demang gondokusuman info fest
1429,uin sunan kalijaga mas
1430,uin sunan kalijaga jogja gera gejayanmemanggil unhas
1431,uin sunan kalijaga jogja gera gejayanmemanggil tolong lurus
1432,uin sunan kalijaga yogyakarta bos
1433,selamat asykar hafidz mahasiswa prodi arab uai tobroni mahasiswa prodi hi uai hasil sabet juara lomba debat bahasa arab tingkat nasional uin sunan kalijaga yogyakarta
1434,september massa aksi gerak uin sunan kalijaga jogjakarta tuju gejayan gejayanmemanggil gejayanbergerak panjangumurperjuangan
1435,uin sunan kalijaga berangkat senayan
1436,diskusi joglitfest dokumentasi budaya lokal era milenial dyah puspitasari amp irfan afifi jumat september wib pustaka uin sunan kalijaga gratis amp buka info amp pendaftran nuri
1437,kompilasi surat edar resmi rektorat sikap aksi mahasiswa september universitas kristen duta wacana uin sunan kalijaga universitas sebelas maret
1438,mahasiswa jogja gerak mahasiswa daerah laku lokasi pertigaaan uin sunan kalijaga yogyakarta video kirim dm
1439,jogja lur sidang buka promosi doktor anas aijudin uin sunan kalijaga sempet liat temen mahasiswa turun jalan mobil rame bet
1440,pamer manuskrip joglitfest september lobby pustaka uin sunan kalijaga jl adi sucipto demang gondokusuman info fest
1441,rekam jejak aksi damai aliansi rakyat gerak judul puisi bangsa karya ainu rizqi mahasiswa aqidah filsafat islam uin sunan kalijaga baca om talang mahasiswa aqidah filsafat islam uin sunan kalijaga
1442,gejayanmemanggil demokrasi uin sunan kalijaga
1443,keluarga pustaka uin sunan kalijaga belasungkawa wafat habib zain bin abdullah bin yahya ayahanda labibah zain mlis kepala pustaka uin suka kalong
1444,kunjung uns laksana agenda kunjung ksr pmi unit vii uin sunan kalijaga yogjakarta ksruns sabtu september aula medical center uns kunjunganksr ksruinsunankalijagajogja pmisiapbantu ksruns
1445,ugm uny universitas sanata dharma uin sunan kalijaga larang gejayan panggil
1446,yogyakarta kau istimewa vidio massa aksi gerak uin sunan kalijaga tuju gejayan gejayanmemanggil yogyakarta aksimassa mahasiswa buruh tani buruhtani kaummiskinkota
1447,gejayanmemanggil mahasiswa uin sunan kalijaga panggil
